text,created_at,Unique Identifier
RT @RightlyNews: @realDonaldTrump @LouDobbs Trust in the media is at the lowest level in all of U.S. history. The American people see throuƒ??,2017-10-14,90
"RT @realDonaldTrump: ""Consumer confidence soars to highest level since 2004""????https://t.co/RvxCPAFI2A https://t.co/U8MS9K45fX",2017-10-14,90
Health Insurance stocks which have gone through the roof during the ObamaCare years plunged yesterday after I ended their Dems windfall!,2017-10-14,90
Very proud of my Executive Order which will allow greatly expanded access and far lower costs for HealthCare. Millions of people benefit!,2017-10-14,90
The Democrats in the Southwest part of Virginia have been abandoned by their Party. Republican Ed Gillespie will never let you down!,2017-10-14,90
RT @mike_pence: We are heading to Virginia. Looking forward to supporting my friend @EdWGillespie. He will make a great Governor for the Coƒ??,2017-10-14,90
RT @EricTrump: .@LaraLeaTrump and I look forward to being on @JudgeJeanine tonight at 9pm! @FoxNews #MakeAmericaGreatAgain ???§???????§???????§???? https://tƒ??,2017-10-14,90
"RT @FoxNews: TONIGHT on ""Justice"" @JudgeJeanine talks to special guests @EricTrump and @LaraLeaTrump - Tune in at 9p ET on Fox News Channeƒ??",2017-10-14,90
The Failing @nytimes in a story by Peter Baker should have mentioned the rapid terminations by me of TPP &amp; The Paris Accord &amp; the fast....,2017-10-15,90
...approvals of The Keystone XL &amp; Dakota Access pipelines. Also look at the recent EPA cancelations &amp; our great new Supreme Court Justice!,2017-10-15,90
RT @mike_pence: .@EdWGillespie is fighting to grow the economy &amp; cut taxes! Heƒ??s fighting for a safer VA. And heƒ??s is fighting for affordabƒ??,2017-10-16,90
RT @ABCNewsRadio: Global fund championed by Ivanka Trump to help women entrepreneurs begins operations https://t.co/jUmsY3ON4x https://t.coƒ??,2017-10-16,90
Art Laffer just said that he doesn't know how a Democrat could vote against the big tax cut/reform bill and live with themselves!  @FoxNews,2017-10-16,90
The Democrats only want to increase taxes and obstruct. That's all they are good at!,2017-10-16,90
Dem Senator Schumer hated the Iran deal made by President Obama but now that I am involved he is OK with it. Tell that to Israel Chuck!,2017-10-16,90
Since Election Day on November 8 the Stock Market is up more than 25% unemployment is at a 17 year low &amp; companies are coming back to U.S.,2017-10-16,90
The U.S. has gained more than 5.2 trillion dollars in Stock Market Value since Election Day! Also record business enthusiasm.,2017-10-16,90
"I was recently asked if Crooked Hillary Clinton is going to run in 2020? My answer was ""I hope so!""",2017-10-16,90
Always great to see the wonderful people of South Carolina. Thank you for the beautiful welcome at Greenville-Spartanburg Int'l Airport! https://t.co/maO9Nc0sTe,2017-10-16,90
RT @Scavino45: U.S. MARKETS FROM ELECTION DAY {Since 11/8/2016} ???? https://t.co/HtjHrznQKJ,2017-10-17,91
Rep.Tom Marino has informed me that he is withdrawing his name from consideration as drug czar. Tom is a fine man and a great Congressman!,2017-10-17,91
Dow Passes 23000 for the First Time Fueled by Strong Earnings#Dow23K????https://t.co/wnkrddYlb9 https://t.co/wlP0NCNcou,2017-10-17,91
Join me LIVE from the Rose Garden at 1:30pmE with Prime Minister Alexis Tsipras of Greece. ƒ?_‹?èhttps://t.co/Bn1vM6fYW9 https://t.co/dZB4mDBKpi,2017-10-17,91
It was my great honor to welcome Prime Minister Alexis Tsipras of Greece to the WH today! ???ùhttps://t.co/Bn1vM6fYW9 ????https://t.co/j0roMFT3YL https://t.co/MPe5HWFcZ1,2017-10-17,91
So much Fake News being put in dying magazines and newspapers. Only place worse may be @NBCNews @CBSNews @ABC and @CNN. Fiction writers!,2017-10-17,91
"Any increase in ObamaCare premiums is the fault of the Democrats for giving us a ""product"" that never had a chance of working.",2017-10-17,91
BORDER WALL prototypes underway! https://t.co/arFNO80zmO,2017-10-17,91
WOW! https://t.co/eKfRktNVuy,2017-10-17,91
Thank you @Heritage! This is our once-in-a-generation opportunity to revitalize our economy revive our industry &amp; renew the AMERICAN DREAM! https://t.co/HI30nojsGo,2017-10-18,91
The most important truth our FOUNDERS understood was: FREEDOM is NOT a gift from Govt. FREEDOM is a GIFT from GOD. ???ùhttps://t.co/rmAzGt8SuG https://t.co/SrPavwrt2R,2017-10-18,91
Wow FBI confirms report that James Comey drafted letter exonerating  Crooked Hillary Clinton long before investigation was complete. Many..,2017-10-18,91
...people not interviewed including Clinton herself. Comey stated under oath that he didn't do this-obviously a fix? Where is Justice Dept?,2017-10-18,91
The Democrats will only vote for Tax Increases. Hopefully all Senate Republicans will vote for the largest Tax Cuts in U.S. history.,2017-10-18,91
As it has turned out James Comey lied and leaked and totally protected Hillary Clinton. He was the best thing that ever happened to her!,2017-10-18,91
The NFL has decided that it will not force players to stand for the playing of our National Anthem. Total disrespect for our great country!,2017-10-18,91
Democrat Congresswoman totally fabricated what I said to the wife of a soldier who died in action (and I have proof). Sad!,2017-10-18,91
I am supportive of Lamar as a person &amp; also of the process but I can never support bailing out ins co's who have made a fortune w/ O'Care.,2017-10-18,91
The current tax code is a burden on American taxpayers &amp; harmful to job-creators. Americans need #TaxReform! More: https://t.co/qXyiYiFWCO https://t.co/NGIjJOc3TP,2017-10-18,91
Our hearts are with all affected by the wildfires in California. God bless our brave First Responders and @FEMA team. We support you! https://t.co/YaoPbaVI5L,2017-10-18,91
It was an honor to welcome Republican and Democratic members of the Senate Finance Committee to the @WhiteHouse today. #TaxReform https://t.co/ge4Xic9fId,2017-10-18,91
Iran hides behind its assertion of technical compliance w/the nuclear deal while it brazenly violates the other limits..Amb. @NikkiHaley https://t.co/xvHgx7d1cT,2017-10-18,91
.@NFL: Too much talk not enough action. Stand for the National Anthem.,2017-10-18,91
This is what REAL PRIDE in our COUNTRY is all about! #USA???§???? https://t.co/kyv866prdE,2017-10-18,91
20000????21000????22000???? 23000????this year...FOUR one thousand milestones this year... #Dow23K #MAGA https://t.co/GQ5f2eVvEI,2017-10-18,91
.@DanaPerino &amp; @BradThorThank you so much for the wonderful compliment. Working hard! #MAGA https://t.co/AKWlsMsCVH,2017-10-18,91
46% of Americans think the Media is inventing stories about Trump &amp; his Administration. @FoxNews   It is actually much worse than this!,2017-10-19,91
Republicans are going for the big Budget approval today first step toward massive tax cuts. I think we have the votes but who knows?,2017-10-19,91
Uranium deal to Russia with Clinton help and Obama Administration knowledge is the biggest story that Fake Media doesn't want to follow!,2017-10-19,91
Workers of firm involved with the discredited and Fake Dossier take the 5th. Who paid for it Russia the FBI or the Dems (or all)?,2017-10-19,91
".@foxandfriends ""Russia sent millions to Clinton Foundation""",2017-10-19,91
RT @USArmy333: @804StreetMedia @realDonaldTrump Heƒ??s done more in 9 months then obama did in8 yrs,2017-10-19,91
It was great to have Governor @RicardoRossello of #PuertoRico???æ???úwith us at the @WhiteHouse today. We are with you! #PRStrong https://t.co/Op2xDZxvNc,2017-10-19,91
"Keep up the GREAT work. I am with you 100%!""ISIS is losing its grip...""Army Colonel Ryan DillonCJTFƒ??OIRhttps://t.co/jVGuvv5mzm https://t.co/PSCXg38CtS",2017-10-20,92
The Fake News is going crazy with wacky Congresswoman Wilson(D) who was SECRETLY on a very personal call and gave a total lie on content!,2017-10-20,92
Big ratings getter @seanhannity and Apprentice Champion John Rich are right now going on stage in Las Vegas for #VegasStrong. Great Show!,2017-10-20,92
Great news on the 2018 budget @SenateMajLdr McConnell - first step toward delivering MASSIVE tax cuts for the American people! #TaxReform https://t.co/aBzQR7KR0c,2017-10-20,92
The Budget passed late last night 51 to 49. We got ZERO Democrat votes with only Rand Paul (he will vote for Tax Cuts) voting against.....,2017-10-20,92
....This now allows for the passage of large scale Tax Cuts (and Reform) which will be the biggest in the history of our country!,2017-10-20,92
"Just out report: ""United Kingdom crime rises 13% annually amid spread of Radical Islamic terror."" Not good we must keep America safe!",2017-10-20,92
Thank you @GeraldoRivera @FoxandFriends. Agree! https://t.co/8cZLdAbgzw,2017-10-20,92
Today it was an honor to have @UNSecretary-General @AntonioGuterres at the @WhiteHouse. Speaking for the U.S.A. we appreciate all you do! https://t.co/Sk0Jcazzxw,2017-10-20,92
This is a once-in-a-generation opportunity to offer historic tax relief to the American people! Join me today: https://t.co/9czcJDbmVW https://t.co/s3kXpvbYih,2017-10-20,92
"Great book just out ""A Place Called Heaven"" by Dr. Robert Jeffress - A wonderful man!",2017-10-20,92
Budget that just passed is a really big deal especially in terms of what will be the biggest tax cut in U.S. history - MSM barely covered!,2017-10-21,92
I hope the Fake News Media keeps talking about Wacky Congresswoman Wilson in that she as a representative is killing the Democrat Party!,2017-10-21,92
Subject to the receipt of further information I will be allowing as President the long blocked and classified JFK FILES to be opened.,2017-10-21,92
RT @IamVicky4Trump: TUNE IN: Maria Bartiromo Has an Exclusive Interview With President Trump https://t.co/H5VuJwy78o,2017-10-21,92
People get what is going on! https://t.co/Pdg7VqQv6M,2017-10-21,92
Stock Market hits another all time high on Friday. 5.3 trillion dollars up since Election. Fake News doesn't spent much time on this!,2017-10-21,92
ƒ??Trump hails liberation of Raqqa as critical breakthrough in anti-ISIS campaignƒ?ù https://t.co/2eoYXJB7h0,2017-10-21,92
"Officials behind the now discredited ""Dossier"" plead the Fifth. Justice Department and/or FBI should immediately release who paid for it.",2017-10-21,92
"Keep hearing about ""tiny"" amount of money spent on Facebook ads. What about the billions of dollars of Fake News on CNN ABC NBC &amp; CBS?",2017-10-21,92
Crooked Hillary Clinton spent hundreds of millions of dollars more on Presidential Election than I did. Facebook was on her side not mine!,2017-10-21,92
"Just out but lightly reported: ""Fewest jobless claims since 1973 show firm U.S. Job Market"" Lowest since March 1973. @bpolitics",2017-10-21,92
I agree getting Tax Cuts approved  is important (we will also get HealthCare) but perhaps no Administration has done more in its first.....,2017-10-21,92
...9 months than this Administration. Over 50 Legislation approvals massive regulation cuts energy freedom pipelines border security....,2017-10-22,92
...2nd Amendment Strong Military ISIS historic VA improvement Supreme Court Justice Record Stock Market lowest unemployment in 17 yrs!,2017-10-22,92
Doing interview today with Maria Bartiromo at 10:00 A.M. on @FoxNews - ENJOY!,2017-10-22,92
Wacky Congresswoman Wilson is the gift that keeps on giving for the Republican Party a disaster for Dems. You watch her in action &amp; vote R!,2017-10-22,92
It is finally sinking through. 46% OF PEOPLE BELIEVE MAJOR NATIONAL NEWS ORGS FABRICATE STORIES ABOUT ME. FAKE NEWS even worse! Lost cred.,2017-10-22,92
There will be NO change to your 401(k). This has always been a great and popular middle class tax break that works and it stays!,2017-10-23,93
Two dozen NFL players continue to kneel during the National Anthem showing total disrespect to our Flag &amp; Country.  No leadership in NFL!,2017-10-23,93
I had a very respectful conversation with the widow of Sgt. La David Johnson and spoke his name from beginning without hesitation!,2017-10-23,93
We will never forget the 241 American service members killed by Hizballah in Beirut. They died in service to our nation. https://t.co/BaQZDA3s2e,2017-10-23,93
Bob Corker who helped President O give us the bad Iran Deal &amp; couldn't get elected dog catcher in Tennessee is now fighting Tax Cuts....,2017-10-24,93
...Corker dropped out of the race in Tennesse when I refused to endorse him and now is only negative on anything Trump. Look at his record!,2017-10-24,93
Isn't it sad that lightweight Senator Bob Corker who couldn't get re-elected in the Great State of Tennessee will now fight Tax Cuts plus!,2017-10-24,93
Sen. Corker is the incompetent head of the Foreign Relations Committee &amp; look how poorly the U.S. has done. He doesn't have a clue as.....,2017-10-24,93
...the entire World WAS laughing and taking advantage of us. People like liddle' Bob Corker have set the U.S. way back. Now we move forward!,2017-10-24,93
Stock Market just hit another record high! Jobs looking very good.,2017-10-24,93
ƒ??President Donald J. Trump Proclaims October 24 2017 as United Nations Dayƒ?ù Read more: https://t.co/cyRAQAKhy2 https://t.co/HVD0kLYlBk,2017-10-24,93
So nice being with Republican Senators today. Multiple standing ovations! Most are great people who want big Tax Cuts and success for U.S.,2017-10-24,93
Clinton campaign &amp; DNC paid for research that led to the anti-Trump Fake News Dossier. The victim here is the President. @FoxNews,2017-10-25,93
The reason Flake and Corker dropped out of the Senate race is very simple they had zero chance of being elected. Now act so hurt &amp; wounded!,2017-10-25,93
The meeting with Republican Senators yesterday outside of Flake and Corker was a love fest with standing ovations and great ideas for USA!,2017-10-25,93
Working hard on the biggest tax cut in U.S. history. Great support from so many sides. Big winners will be the middle class business &amp; JOBS,2017-10-25,93
"Jeff Flake with an 18% approval rating in Arizona said ""a lot of my colleagues have spoken out."" Really they just gave me a standing O!",2017-10-25,93
MAKE AMERICA GREAT AGAIN! https://t.co/CbEwJSQ1A3,2017-10-25,93
Congrats to @Reince Priebus a really good and talented man. Weƒ??re proud of you Reince! https://t.co/7AsjAMrSnV,2017-10-25,93
Just interviewed by @LouDobbs. Will be aired tonight at 7pmE on @FoxBusiness. #Dobbs,2017-10-25,93
Spoke to President Xi of China to congratulate him on his extraordinary elevation. Also discussed NoKo &amp; trade two very important subjects!,2017-10-25,93
Melania and I look forward to being with President Xi &amp; Madame Peng Liyuan in China in two weeks for what will hopefully be a historic trip! https://t.co/uFMonzza7N,2017-10-25,93
The long anticipated release of the #JFKFiles will take place tomorrow. So interesting!,2017-10-25,93
Texas @GovAbbott &amp; Lt. Gov. @DanPatrickThank you for todays briefing on hurricane recovery efforts here in TX. Keep up the great work! https://t.co/rBel6IWrJl,2017-10-25,93
Interview with @LouDobbs coming up at 7pmE on @FoxBusiness. Enjoy! https://t.co/9V9z015kVl,2017-10-25,93
RT @IvankaTrump: Working families need #TaxReform &amp; the time is now. This Administration is committed to ensuring all Americans can thriveƒ??,2017-10-26,94
This will be the biggest TAX CUT in the history of our country - and we need it! #TaxReform Read more: https://t.co/o3W9bJkz5k https://t.co/JYckXWEmLu,2017-10-26,94
Together we will Make America Great Again!#AmericaFirst???§???? https://t.co/ajiC3flNkI,2017-10-26,94
RT @PChowka: Fox News With Hannity's Help Regains Its Ratings Dominance By Peter Barry Chowka at The Hagmann report https://t.co/ICDMCZreguƒ??,2017-10-26,94
Will be another Sean success! https://t.co/SlNTENvJLA,2017-10-26,94
RT @seanhannity: BOOM!!  Tick Tock https://t.co/8E2Lvj3TTa,2017-10-26,94
Ed Gillespie will turn the really bad Virginia economy #'s around and fast. Strong on crime he might even save our great statues/heritage!,2017-10-26,94
Ed Gillespie will be a great Governor of Virginia. His opponent doesn't even show up to meetings/work and will be VERY weak on crime!,2017-10-26,94
Do not underestimate the UNITY within the Republican Party!,2017-10-26,94
Big news - Budget just passed!,2017-10-26,94
Effective today my administration officially declared the #OpioidCrisis a NATIONAL PUBLIC HEALTH EMERGENCY under federal law. https://t.co/YosOBurdCw,2017-10-26,94
WORKING TOGETHER we will defeat this #OpioidEpidemic &amp; free our nation from the terrible affliction of drug abuse. https://t.co/iAZjqGMwav https://t.co/mZI5uQN4oZ,2017-10-27,94
Wacky &amp; totally unhinged Tom Steyer who has been fighting me and my Make America Great Again agenda from beginning never wins elections!,2017-10-27,94
Thank you @foxandfriends. Really great job and show!,2017-10-27,94
Congratulations to @SpeakerRyan @GOPLeader @SteveScalise and to the Republican Party on Budget passage yesterday. Now for biggest Tax Cuts,2017-10-27,94
Good luck to @Joy_Villa on her decision to enter the wonderful world of politics. She has many fans!,2017-10-27,94
Happy birthday to the great @leegreenwood83. You and your beautiful song have made such a difference. MAKE AMERICA GREAT AGAIN!,2017-10-27,94
JFK Files are being carefully released. In the end there will be great transparency. It is my hope to get just about everything to public!,2017-10-27,94
Happy birthday to the great @TheLeeGreenwood. You and your beautiful song have made such a difference. MAKE AMERICA GREAT AGAIN!,2017-10-27,94
It is now commonly agreed after many months of COSTLY looking that there was NO collusion between Russia and Trump. Was collusion with HC!,2017-10-27,94
Thank you @FLGovScott. https://t.co/rgdU9plvFK,2017-10-27,94
Diane Black of Tennessee the highly respected House Budget Committee Chairwoman did a GREAT job in passing Budget setting up big Tax Cuts,2017-10-27,94
We are inspired by the stories of everyday heroes who pull their communities from the depths of despair through leadership and love. https://t.co/DL3oan4Fm7,2017-10-27,94
.@FoxNews Chris Wallace: ƒ??More evidence of Dem collusion with Russia than GOPƒ?ù https://t.co/nACQerJSiu,2017-10-27,94
People are anxiously awaiting my decision as to who the next head of the Fed will be....???ùhttps://t.co/PEj1KNYcAO,2017-10-27,94
Happy Birthday @TheLeeGreenwood!#FlashbackFriday https://t.co/MCrMK6Eurm,2017-10-27,94
#JFKFiles https://t.co/AnPBSJFh3J,2017-10-28,94
ƒ??WHAT HAPPENEDƒ?ùƒ??How Team Hillary played the press for fools on Russiaƒ?ùƒ?_‹?èhttps://t.co/GqpIidk017NOW WE KNOW! https://t.co/SgWL1HZmkI,2017-10-28,94
Very little reporting about the GREAT GDP numbers announced yesterday (3.0 despite the big hurricane hits). Best consecutive Q's in years!,2017-10-28,94
Just read the nice remarks by President Jimmy Carter about me and how badly I am treated by the press (Fake News). Thank you Mr. President!,2017-10-28,94
Today is National Prescription Drug Take Back Day. Everyone can help fight the #OpioidEpidemic by participating! https://t.co/ONObTWOaOn https://t.co/CYG11DnxH7,2017-10-28,94
After strict consultation with General Kelly the CIA and other Agencies I will be releasing ALL #JFKFiles other than the names and...,2017-10-28,94
...addresses of any mentioned person who is still living. I am doing this for reasons of full disclosure transparency and...,2017-10-28,94
...in order to put any and all conspiracy theories to rest.,2017-10-28,94
Happy #FirstRespondersDay to all of our HEROES out there. We are forever grateful to you for your service sacrifice and courage 24/7/365! https://t.co/vOcTlyOeyw,2017-10-28,94
While not at all presidential I must point out that the Sloppy Michael Moore Show on Broadway was a TOTAL BOMB and was forced to close. Sad!,2017-10-28,94
JFK Files are released long ahead of schedule!,2017-10-28,94
As usual the ObamaCare premiums will be up (the Dems own it) but we will Repeal &amp; Replace and have great Healthcare soon after Tax Cuts!,2017-10-29,95
Never seen such Republican ANGER &amp; UNITY as I have concerning the lack of investigation on Clinton made Fake Dossier (now $12000000?)....,2017-10-29,95
...the Uranium to Russia deal the  33000 plus deleted Emails the Comey fix and so much more. Instead they look at phony Trump/Russia....,2017-10-29,95
"...""collusion"" which doesn't exist. The Dems are using this terrible (and bad for our country) Witch Hunt for evil politics but the R's...",2017-10-29,95
...are now fighting back like never before. There is so much GUILT by Democrats/Clinton and now the facts are pouring out. DO SOMETHING!,2017-10-29,95
"All of this ""Russia"" talk right when the Republicans are making their big push for historic Tax Cuts &amp; Reform. Is this coincidental? NOT!",2017-10-29,95
Report out that Obama Campaign paid $972000 to Fusion GPS. The firm also got $12400000 (really?) from DNC. Nobody knows who OK'd!,2017-10-30,95
Great job by MichaelCaputo on @foxandfriends.,2017-10-30,95
Sorry but this is years ago before Paul Manafort was part of the Trump campaign. But why aren't Crooked Hillary &amp; the Dems the focus?????,2017-10-30,95
....Also there is NO COLLUSION!,2017-10-30,95
"The Fake News is working overtime. As Paul Manaforts lawyer said there was ""no collusion"" and events mentioned took place long before he...",2017-10-31,95
....came to the campaign. Few people knew the young low level volunteer named George who has already proven to be a liar. Check the DEMS!,2017-10-31,95
I hope people will start to focus on our Massive Tax Cuts for Business (jobs) and the Middle Class (in addition to Democrat corruption)!,2017-10-31,95
The biggest story yesterday the one that has the Dems in a dither is Podesta running from his firm. What he know about Crooked Dems is....,2017-10-31,95
....earth shattering. He and his brother could Drain The Swamp which would be yet another campaign promise fulfilled. Fake News weak!,2017-10-31,95
ƒ??Statement by President Trump on the Apprehension of Mustafa al-Imam for His Alleged Role in Benghazi Attacksƒ?ù https://t.co/2U7WJmfGlM,2017-10-31,95
Thank you @LuisRiveraMarin! https://t.co/BK7sDv9phU,2017-10-31,95
Wishing everyone a safe and Happy Halloween!#Halloween2017 https://t.co/BRpgXVRI8Y,2017-10-31,95
RT @IvankaTrump: We're working to make tax cuts &amp; the expanded Child Tax Credit a reality for American families. The time is now! #TaxReforƒ??,2017-10-31,95
Consumer Confidence Hits Highest Level Since December 2000 Read more: https://t.co/w7WkcobFun https://t.co/nLo5XCnuIx,2017-10-31,95
ƒ??Home Prices Reach New All-Time Highs in Augustƒ?ù Read more: https://t.co/XzJiZgGQ8R https://t.co/STBtR6mO2j,2017-10-31,95
U.S. COAL PRODUCTIONUp????7.8% past year. Down????31.5% last 10 years. #EndingWarOnCoal https://t.co/xr20OBb2DV,2017-10-31,95
In NYC looks like another attack by a very sick and deranged person. Law enforcement is following this closely. NOT IN THE U.S.A.!,2017-10-31,95
We must not allow ISIS to return or enter our country after defeating them in the Middle East and elsewhere. Enough!,2017-10-31,95
My thoughts condolences and prayers to the victims and families of the New York City terrorist attack. God and your country are with you!,2017-10-31,95
The Republican House members are working hard (and late) toward the Massive Tax Cuts that they know you deserve. These will be biggest ever!,2017-11-01,96
I have just ordered Homeland Security to step up our already Extreme Vetting Program. Being politically correct is fine but not for this!,2017-11-01,96
"The terrorist came into our country through what is called the ""Diversity Visa Lottery Program"" a Chuck Schumer beauty. I want merit based.",2017-11-01,96
We are fighting hard for Merit Based immigration no more Democrat Lottery Systems. We must get MUCH tougher (and smarter).  @foxandfriends,2017-11-01,96
Senator Chuck Schumer helping to import Europes problems said Col.Tony Shaffer. We will stop this craziness!  @foxandfriends,2017-11-01,96
#NYCStrong #USA???§???? https://t.co/6K3Xw5P87d,2017-11-01,96
Wouldn't it be great to Repeal the very unfair and unpopular Individual Mandate in ObamaCare and use those savings for further Tax Cuts.....,2017-11-01,96
....for the Middle Class. The House and Senate should consider ASAP as the process of final approval moves along. Push Biggest Tax Cuts EVER,2017-11-01,96
We mourn the horrifying terrorist attack in NYC. All of America is praying and grieving for the families who lost their precious loved ones. https://t.co/WZFHXoJE3K,2017-11-01,96
Just spoke with @NYGovCuomo and @NYCMayor de Blasio to let them know that the federal government...,2017-11-01,96
@NYGovCuomo @NYCMayor ...fully supports any and all of their efforts with respect to the West Side attack. #NYCStrong,2017-11-01,96
Thank you to the GREAT NYPD First Responders and all govt officials for having handled the terrible West Side attack so professionally! https://t.co/imPIdOzjAn,2017-11-01,96
Thanks to @SenateMajLdr McConnell and the @SenateGOP we are appointing high-quality Federal District...,2017-11-01,96
@SenateMajLdr @SenateGOP ...and Appeals Court Judges at a record clip! Our courts are rapidly changing for the better!,2017-11-01,96
CHAIN MIGRATION must end now! Some people come in and they bring their whole family with them who can be truly evil. NOT ACCEPTABLE! https://t.co/PQGeTTdRtX,2017-11-01,96
Just spoke to President Macri of Argentina about the five proud and wonderful men killed in the West Side terror attack. God be with them!,2017-11-02,96
The United States will be immediately implementing much tougher Extreme Vetting Procedures. The safety of our citizens comes first!,2017-11-02,96
