text,created_at,Unique Identifier
Rep. Steve Scalise of Louisiana a true friend and patriot was badly injured but will fully recover. Our thoughts and prayers are with him.,2017-06-14,49
Happy birthday to U.S. ARMY and our soldiers. Thank you for your bravery sacrifices &amp; dedication. Proud to be your Commander-in-Chief!,2017-06-14,49
Just left hospital. Rep. Steve Scalise one of the truly great people is in very tough shape - but he is a real fighter. Pray for Steve!,2017-06-15,49
They made up a phony collusion with the Russians story found zero proof so now they go for obstruction of justice on the phony story. Nice,2017-06-15,49
You are witnessing the single greatest WITCH HUNT in American political history - led by some very bad and conflicted people!  #MAGA,2017-06-15,49
Why is that Hillary Clintons family and Dems dealings with Russia are not looked at but my non-dealings are?,2017-06-15,49
Crooked H destroyed phones w/ hammer 'bleached' emails &amp; had husband meet w/AG days before she was cleared- &amp; they talk about obstruction?,2017-06-15,49
Thank you Wisconsin! Tuesday was a great success for #WorkforceWeek at @WCTC w/ @IvankaTrump &amp; @GovWalker. Remarksƒ?? https://t.co/L8o396yYKX,2017-06-15,49
#CongressionalBaseballGameƒ??‹?è https://t.co/u8InOJTf6D,2017-06-15,49
"After 7 months of investigations &amp; committee hearings about my ""collusion with the Russians""  nobody has been able to show any proof. Sad!",2017-06-16,50
The Fake News Media hates when I use what has turned out to be my very powerful Social Media - over 100 million people! I can go around them,2017-06-16,50
Despite the phony Witch Hunt going on in America the economic &amp; jobs numbers are great. Regulations way down jobs and enthusiasm way up!,2017-06-16,50
I am being investigated for firing the FBI Director by the man who told me to fire the FBI Director! Witch Hunt,2017-06-16,50
Great news! #MAGA https://t.co/pirHR7lAyT,2017-06-16,50
Remarks by President Trump on the Policy of the U.S.A. Towards CubaVideo: https://t.co/jUWCjgxX5DTranscript:ƒ?? https://t.co/hILCHbPJet,2017-06-16,50
National Security Presidential Memorandum on Strengthening the Policy of the United States Toward CubaMemorandumƒ?? https://t.co/RVr9Dg2hXt,2017-06-16,50
Back from Miami where my Cuban/American friends are very happy with what I signed today. Another campaign promise that I did not forget!,2017-06-17,50
RT @seanhannity: #Hannity Starts in 30 minutes with @newtgingrich and my monologue on the Deep Stateƒ??s allies in the media,2017-06-17,50
Thoughts and prayers with the sailors of USS Fitzgerald and their families. Thank you to our Japanese allies for thƒ?? https://t.co/BBvmTFxVkk,2017-06-17,50
The MAKE AMERICA GREAT AGAIN agenda is doing very well despite the distraction of the Witch Hunt. Many new jobs high business enthusiasm..,2017-06-18,50
...massive regulation cuts 36 new legislative bills signed great new S.C.Justice and Infrastructure Healthcare and Tax Cuts in works!,2017-06-18,50
The new Rasmussen Poll one of the most accurate in the 2016 Election just out with a Trump 50% Approval Rating.That's higher than O's #'s!,2017-06-18,50
RT @DiamondandSilk: The Media Says:  The President Should Stop Tweeting about Russia.  Well Why Don't the Media Take Their Own Advice &amp; Sƒ??,2017-06-18,50
RT @DonaldJTrumpJr: Not surprising at all! Father Of Otto Warmbier: Obama Admin Told Us To Keep Quiet Trump Admin Brought Him Home  httpsƒ??,2017-06-18,50
Camp David is a very special place. An honor to have spent the weekend there. Military runs it so well and are so proud of what they do!,2017-06-18,50
RT @WhiteHouse: Happy Father's Day! https://t.co/32tFoVa4Ov,2017-06-18,50
Jay Sekulow on @foxandfriends now.,2017-06-19,51
The Dems want to stop tax cuts good healthcare and Border Security.Their ObamaCare is dead with 100% increases in P's. Vote now for Karen H,2017-06-19,51
My heartfelt thoughts and prayers are with the 7 @USNavy sailors of the #USSFitzgerald and their families. ƒ?_‹?èƒ?? https://t.co/L3u5c8Iymh,2017-06-19,51
Ralph Norman who is running for Congress in SC's 5th District will be a fantastic help to me in cutting taxes and....,2017-06-19,51
....getting great border security and healthcare. #VoteRalphNorman tomorrow!,2017-06-19,51
Karen Handle's opponent in #GA06 can't even vote in the district he wants to represent....,2017-06-19,51
....because he doesn't live there! He wants to raise taxes &amp; kill healthcare. On Tuesday #VoteKarenHandel.,2017-06-19,51
Karen Handel's opponent in #GA06 can't even vote in the district he wants to represent....,2017-06-19,51
....because he doesn't even live there! He wants to raise taxes and kill healthcare. On Tuesday #VoteKarenHandel.,2017-06-19,51
It was my great honor to welcome President @JC_Varela &amp; Mrs. Varela from Panama this afternoon.???§???????æ????ƒ?_‹?èƒ?? https://t.co/770OJj2uYb,2017-06-19,51
Melania and I offer our deepest condolences to the family of Otto Warmbier. Full statement: https://t.co/8kmcA6YtFD https://t.co/EhrP4BiJeB,2017-06-19,51
RT @FoxNews: New Poll Shows @POTUS Approval at 50 Percenthttps://t.co/FRWlSVvxzQ,2017-06-19,51
RT @joegooding: What's happening in our country isn't just an assault on our @POTUS @realDonaldTrump it's an assault on the American peopleƒ??,2017-06-19,51
"Big day tomorrow in Georgia and South Carolina. ObamaCare is dead. Dems want to raise taxes big! They can only obstruct no ideas. Vote ""R""",2017-06-20,51
Democrat Jon Ossoff who wants to raise your taxes to the highest level and is weak on crime and security doesn't even live in district.,2017-06-20,51
RT @SheriffClarke: Happy Father's Day to all dads. My dad. Like father like son @realDonaldTrump supporters to the end. He an Airborne Raƒ??,2017-06-20,51
KAREN HANDEL FOR CONGRESS. She will fight for lower taxes great healthcare strong security-a hard worker who will never give up! VOTE TODAY,2017-06-20,51
The U.S. once again condemns the brutality of the North Korean regime as we mourn its latest victim. Video: https://t.co/Rvm11ZbPk7,2017-06-20,51
While I greatly appreciate the efforts of President Xi &amp; China to help with North Korea it has not worked out. At least I know China tried!,2017-06-20,51
It was a great honor to welcome President Petro Poroshenko of Ukraine to the @WhiteHouse today with @VP Pence.ƒ?_‹?èƒ?? https://t.co/J1ulOd6pYQ,2017-06-21,51
Things are looking great for Karen H!,2017-06-21,51
"Thank you @FoxNews ""Huge win for President Trump and GOP in Georgia Congressional Special Election.""",2017-06-21,51
Congratulations to Karen Handel on her big win in Georgia 6th. Fantastic job we are all very proud of you!,2017-06-21,51
Ralph Norman ran a fantastic race to win in the Great State of South Carolina's 5th District. We are all honored by your success tonight!,2017-06-21,51
Well the Special Elections are over and those that want to MAKE AMERICA GREAT AGAIN are 5 and O! All the Fake News all the money spent = 0,2017-06-21,51
Democrats would do much better as a party if they got together with Republicans on HealthcareTax CutsSecurity. Obstruction doesn't work!,2017-06-21,51
Just landed in Iowa. See everyone soon! #MAGA???§????,2017-06-21,51
Thank you Kirkwood Community College. Heading to the U.S. Cellular Center now for an 8pmE MAKE AMERICA GREAT AGAINƒ?? https://t.co/n6LS32a6Zn,2017-06-21,51
Great night in Iowa - special people. Thank you!,2017-06-22,52
Former Homeland Security Advisor Jeh Johnson is latest top intelligence official to state there was no grand scheme between Trump &amp; Russia.,2017-06-22,52
By the way if Russia was working so hard on the 2016 Election it all took place during the Obama Admin. Why didn't they stop them?,2017-06-22,52
...Why did Democratic National Committee turn down the DHS offer to protect against hacks (long prior to election). It's all a big Dem HOAX!,2017-06-22,52
...Why did the DNC REFUSE to turn over its Server to the FBI and still hasn't? It's all a big Dem scam and excuse for losing the election!,2017-06-22,52
I certainly hope the Democrats do not force Nancy P out. That would be very bad for the Republican Party - and please let Cryin' Chuck stay!,2017-06-22,52
With all of the recently reported electronic surveillance intercepts unmasking and illegal leaking of information I have no idea...,2017-06-22,52
"...whether there are ""tapes"" or recordings of my conversations with James Comey but I did not make and do not have any such recordings.",2017-06-22,52
"As promised our campaign against the MS-13 gang continues. ""@ICEgov Busts 39 MS-13 Members in New York Operation""https://t.co/ki41GXeCMy",2017-06-22,52
Mexico was just ranked the second deadliest country in the world after only Syria. Drug trade is largely the cause. We will BUILD THE WALL!,2017-06-22,52
I am very supportive of the Senate #HealthcareBill. Look forward to making it really special! Remember ObamaCare is dead.,2017-06-22,52
Together we are going to MAKE AMERICA GREAT AGAIN!#AmericaFirst???§???? https://t.co/MVJbs44AtR,2017-06-22,52
We're all thinking of you @SteveScalise! #TeamScalise https://t.co/Yqf6exhm7x,2017-06-22,52
.@FLOTUS &amp; I were honored to host our first WH Congressional Picnic. A wonderful evening &amp; tradition. @MarineBand:ƒ?? https://t.co/h5L4myWmam,2017-06-23,52
RT @foxnation: .@SenTedCruz: I want to Get to a 'Yes' Vote: https://t.co/g0vafw4ef2,2017-06-23,52
RT @foxandfriends: POTUS the predictor? President Trump foretold housing upswing in 2012 https://t.co/N3LMDZKTK1,2017-06-23,52
Will be on @foxandfriends. Enjoy!,2017-06-23,52
I've helped pass and signed 38 Legislative Bills mostly with no Democratic support and gotten rid of massive amounts of regulations. Nice!,2017-06-23,52
Today it was a tremendous honor for me to sign the #VAaccountability Act into law delivering my campaign promiseƒ?? https://t.co/G0k8nFWqNj,2017-06-23,52
WEEKLY ADDRESS???§???? https://t.co/P1f12i9Gvt,2017-06-23,52
Just out: The Obama Administration knew far in advance of November 8th about election meddling by Russia. Did nothing about it. WHY?,2017-06-24,52
Democrats slam GOP healthcare proposal as Obamacare premiums &amp; deductibles increase by over 100%. Remember keep your doctor keep your plan?,2017-06-24,52
Since the Obama Administration was told way before the 2016 Election that the Russians were meddling why no action? Focus on them not T!,2017-06-24,52
"Obama Administration official said they ""choked"" when it came to acting on Russian meddling of election. They didn't want to hurt Hillary?",2017-06-24,52
I cannot imagine that these very fine Republican Senators would allow the American people to suffer a broken ObamaCare any longer!,2017-06-24,52
MAKE AMERICA GREAT AGAIN!,2017-06-24,52
Hillary Clinton colluded with the Democratic Party in order to beat Crazy Bernie Sanders. Is she allowed to so collude? Unfair to Bernie!,2017-06-25,53
I am on @foxandfriends - Enjoy!,2017-06-25,53
The Democrats have become nothing but OBSTRUCTIONISTS they have no policies or ideas. All they do is delay and complain.They own ObamaCare!,2017-06-26,53
The reason that President Obama did NOTHING about Russia after being notified by the CIA of meddling is that he expected Clinton would win..,2017-06-26,53
"...and did not want to ""rock the boat."" He didn't ""choke"" he colluded or obstructed and it did the Dems and Crooked Hillary no good.",2017-06-26,53
The real story is that President Obama did NOTHING after being informed in August about Russian meddling. With 4 months looking at Russia...,2017-06-26,53
"..under a magnifying glass they have zero ""tapes"" of T people colluding. There is no collusion &amp; no obstruction. I should be given apology!",2017-06-26,53
Republican Senators are working very hard to get there with no help from the Democrats. Not easy! Perhaps just let OCare crash &amp; burn!,2017-06-26,53
RT @WhiteHouse: #Obamacare has led to higher costs and fewer health insurance options for millions of Americans. It has failed the Americanƒ??,2017-06-26,53
RT @WhiteHouse: Today @POTUS will welcome the Prime Minister of India @narendramodi to the White House. https://t.co/MIi1ifmdAN,2017-06-26,53
Very grateful for the 9-O decision from the U. S. Supreme Court. We must keep America SAFE!,2017-06-26,53
RT @WhiteHouse: FACT: when #Obamacare was signed CBO estimated that 23M would be covered in 2017. They were off by 100%. Only 10.3M peopleƒ??,2017-06-27,53
"From @FoxNews ""Bombshell: In 2016 Obama dismissed idea that anyone could rig an American election.""  Check out his statement - Witch Hunt!",2017-06-27,53
Great day for America's future Security and Safety courtesy of the U.S. Supreme Court. I will keep fighting for the American people &amp; WIN!,2017-06-27,53
"Wow CNN had to retract big story on ""Russia"" with 3 employees forced to resign. What about all the other phony stories they do? FAKE NEWS!",2017-06-27,53
RT @JeffTutorials: @realDonaldTrump  https://t.co/6sDcyiW4Kt,2017-06-27,53
RT @foxandfriends: Mark Levin: The collusion is among the Democrats https://t.co/Qrca7r01BI,2017-06-27,53
RT @foxandfriends: Hannity: Russia allegations 'boomeranging back' on Democrats https://t.co/lvdrpxpcp9,2017-06-27,53
RT @foxandfriends: Another Dem 'queasy' over claim of Loretta Lynch meddling in Clinton case https://t.co/wdQ9MduxOO,2017-06-27,53
RT @foxandfriends: President Trump officially nominates former Assistant Attorney General Christopher Wray to head the FBI https://t.co/ld7ƒ??,2017-06-27,53
"RT @ericbolling: Good morning friends!  ""The Swamp"" out today.  President Trump has a copy... get yours here https://t.co/TntLPNCCjR. #magaƒ??",2017-06-27,53
Fake News CNN is looking at big management changes now that they got caught falsely pushing their phony Russian stories. Ratings way down!,2017-06-27,53
So they caught Fake News CNN cold but what about NBC CBS &amp; ABC? What about the failing @nytimes &amp; @washingtonpost? They are all Fake News!,2017-06-27,53
With ZERO Democrats to help and a failed expensive and dangerous ObamaCare as the Dems legacy the Republican Senators are working hard!,2017-06-27,53
I just finished a great meeting with the Republican Senators concerning HealthCare. They really want to get it right unlike OCare!,2017-06-27,53
The failing @nytimes writes false story after false story about me. They don't even call to verify the facts of a story. A Fake News Joke!,2017-06-28,54
Some of the Fake News Media likes to say that I am not totally engaged in healthcare. Wrong I know the subject well &amp; want victory for U.S.,2017-06-28,54
RT @foxandfriends: HAPPENING TODAY: House to vote on immigration bills including 'Kateƒ??s Law' and 'No Sanctuary for Criminals Act' https://ƒ??,2017-06-28,54
The #AmazonWashingtonPost sometimes referred to as the guardian of Amazon not paying internet taxes (which they should) is FAKE NEWS!,2017-06-28,54
#ICYMI- on Monday I had the great honor of welcoming India's Prime Minister @narendramodi to the WH. Full Remarks:ƒ?? https://t.co/7IIQEh7xXv,2017-06-28,54
It was my great honor to welcome the 2016 World Series Champion Chicago @Cubs ƒ??‹?è to the @WhiteHouse this afternoon.ƒ?? https://t.co/GvPhJ9hZdv,2017-06-28,54
Today I hosted an immigration roundtable ahead of two votes taking place in Congress tomorrow. Watch and read moreƒ?? https://t.co/5k8WzW1t68,2017-06-28,54
Democrats purposely misstated Medicaid under new Senate bill - actually goes up. https://t.co/necCt4K6UH,2017-06-28,54
From my first day in office weƒ??ve taken swift action to lift the crushing restrictions on American energy. Remarksƒ?? https://t.co/VBoEubD59k,2017-06-28,54
Tomorrow the House votes on #KatesLaw &amp; No Sanctuary For Criminals Act. Lawmakers must vote to put American safetyƒ?? https://t.co/p3vd8IXXaD,2017-06-29,54
New Sugar deal negotiated with Mexico is a very good one for both Mexico and the U.S. Had no deal for many years which hurt U.S. badly.,2017-06-29,54
I heard poorly rated @Morning_Joe speaks badly of me (don't watch anymore). Then how come low I.Q. Crazy Mika along with Psycho Joe came..,2017-06-29,54
...to Mar-a-Lago 3 nights in a row around New Year's Eve and insisted on joining me. She was bleeding badly from a face-lift. I said no!,2017-06-29,54
Today the House votes on two crucial bills:ƒ??‹?è#NoSanctuaryForCriminalsAct ƒ??‹?è#KatesLaw ƒ??‹?èPass these bills &amp; letsƒ?? https://t.co/4N2c0oxMve,2017-06-29,54
MAKE AMERICA SAFE AGAIN!#NoSanctuaryForCriminalsAct #KatesLaw #SaveAmericanLives https://t.co/jbN4hPjqjS,2017-06-29,54
Join me LIVE with @VP @SecretaryPerry @SecretaryZinke and @EPAScottPruitt. #UnleashingAmericanEnergyhttps://t.co/hlM7F2BQD9,2017-06-29,54
Mattis Says Trumpƒ??s Warning Stopped Chemical Weapons Attack In Syria https://t.co/XL9LLNKh8i,2017-06-29,54
Good news House just passed #KatesLaw. Hopefully Senate will follow.,2017-06-29,54
Good news out of the House with the passing of 'No Sanctuary for Criminals Act.' Hopefully Senate will follow.,2017-06-29,54
Statement on House Passage of Kateƒ??s Law and No Sanctuary for Criminals Act. https://t.co/uPRy9XgK5A,2017-06-29,54
When it comes to the future of Americaƒ??s energy needs we will FIND IT we will DREAM IT and we will BUILD IT.ƒ?? https://t.co/m0HmPbUZ6C,2017-06-29,54
Our new American Energy Policy will unlock MILLIONS of jobs &amp; TRILLIONS in wealth. We are on the cusp of a true eneƒ?? https://t.co/w5Y7UXZSSD,2017-06-29,54
Just finished a very good meeting with the President of South Korea. Many subjects discussed including North Korea and new trade deal!,2017-06-30,54
If Republican Senators are unable to pass what they are working on now they should immediately REPEAL and then REPLACE at a later date!,2017-06-30,54
Crime and killings in Chicago have reached such epidemic proportions that I am sending in Federal help. 1714 shootings in Chicago this year!,2017-06-30,54
Watched low rated @Morning_Joe for first time in long time. FAKE NEWS. He called me to stop a National Enquirer article. I said no! Bad show,2017-06-30,54
I am encouraged by President Moon's assurances that he will work to level the playing field for American workers bƒ?? https://t.co/DUZh6aMjJS,2017-06-30,54
The era of strategic patience with the North Korea regime has failed. That patience is over. We are working closelyƒ?? https://t.co/MxN04V2Yn4,2017-06-30,54
America will THINK BIG once again. We will inspire millions of children to carry on the proud tradition of Americanƒ?? https://t.co/hZCMp5cSJc,2017-06-30,54
Happy Canada Day to all of the great people of Canada and to your Prime Minister and my new found friend @JustinTrudeau. #Canada150,2017-07-01,55
Word is that @Greta Van Susteren was let go by her out of control bosses at @NBC &amp; @Comcast because she refused to go along w/ 'Trump hate!',2017-07-01,55
Numerous states are refusing to give information to the very distinguished VOTER FRAUD PANEL. What are they trying to hide?,2017-07-01,55
I am extremely pleased to see that @CNN has finally been exposed as #FakeNews and garbage journalism. It's about time!,2017-07-01,55
Crazy Joe Scarborough and dumb as a rock Mika are not bad people but their low rated show is dominated by their NBC bosses. Too bad!,2017-07-01,55
Weekly Address???§???? #KatesLaw#NoSanctuaryForCriminalsActStatement: https://t.co/I8cqKGDK2B https://t.co/00mao6Vk7R,2017-07-01,55
Getting rdy to leave for tonight's Celebrate Freedom Concert honoring our GREAT VETERANS w/ so many of my evangelicƒ?? https://t.co/shfTAoMJry,2017-07-01,55
The FAKE &amp; FRAUDULENT NEWS MEDIA is working hard to convince Republicans and others I should not use social media - but remember I won....,2017-07-01,55
....the 2016 election with interviews speeches and social media. I had to beat #FakeNews and did. We will continue to WIN!,2017-07-01,55
I am thinking about changing the name #FakeNews CNN to #FraudNewsCNN!,2017-07-01,55
My use of social media is not Presidential - itƒ??s MODERN DAY PRESIDENTIAL. Make America Great Again!,2017-07-01,55
We will always take care of our GREAT VETERANS. You have shed your blood poured your love and bared your soul inƒ?? https://t.co/bTPuerxLOr,2017-07-02,55
#FraudNewsCNN #FNN https://t.co/WYUnHjjUjg,2017-07-02,55
The dishonest media will NEVER keep us from accomplishing our objectives on behalf of our GREAT AMERICAN PEOPLE!ƒ?? https://t.co/EwnwCeuGMv,2017-07-02,55
Stock Market at all time high unemployment at lowest level in years (wages will start going up) and our base has never been stronger!,2017-07-02,55
America's men &amp; women in uniform is the story of FREEDOM overcoming OPPRESSION the STRONG protecting the WEAK &amp; Gƒ?? https://t.co/LtTpGsP3fC,2017-07-03,55
Will be speaking with Germany and France this morning.,2017-07-03,55
Spoke yesterday with the King of Saudi Arabia about peace in the Middle-East. Interesting things are happening!,2017-07-03,55
Will be speaking with Italy this morning!,2017-07-03,55
At some point the Fake News will be forced to discuss our great jobs numbers strong economy success with ISIS the border &amp; so much else!,2017-07-03,55
If we can help little #CharlieGard as per our friends in the U.K. and the Pope we would be delighted to do so.,2017-07-03,55
RT @Reince: With a strong candidate in @POTUS &amp; @GOP revolutionary data program Republicans carried WI for 1st time in 30 yearshttps://t.ƒ??,2017-07-03,55
Thank you to Shawn Steel for the nice words on @FoxNews.,2017-07-03,55
Really great numbers on jobs &amp; the economy! Things are starting to kick in now and we have just begun! Don't like steel &amp; aluminum dumping!,2017-07-03,55
Dow hit a new intraday all-time high! I wonder whether or not the Fake News Media will so report?,2017-07-03,55
RT @JacobAWohl: @realDonaldTrump When Obama was President the #MSM LOVED talking about stock market rallies! Now they barely mention new aƒ??,2017-07-04,56
North Korea has just launched another missile. Does this guy have anything better to do with his life? Hard to believe that South Korea.....,2017-07-04,56
....and Japan will put up with this much longer. Perhaps China will put a heavy move on North Korea and end this nonsense once and for all!,2017-07-04,56
#HappyIndependenceDay #July4 #USA???§???? https://t.co/NsFslPEFrp,2017-07-04,56
Getting ready to celebrate the 4th of July with a big crowd at the White House. Happy 4th to everyone. Our country will grow and prosper!,2017-07-04,56
Gas prices are the lowest in the U.S. in over ten years! I would like to see them go even lower.,2017-07-04,56
#HappyIndependenceDay #USA???§???? https://t.co/9pfqnRsh1Z,2017-07-05,56
Getting ready to leave for Poland after which I will travel to Germany for the G-20. Will be back on Saturday.,2017-07-05,56
The United States made some of the worst Trade Deals in world history.Why should we continue these deals with countries that do not help us?,2017-07-05,56
Trade between China and North Korea grew almost 40% in the first quarter. So much for China working with us - but we had to give it a try!,2017-07-05,56
Congratulations to the dedicated professionals of the USSS as they celebrate their 152nd anniversary. Thank you! ƒ?_‹?èhttps://t.co/mDhFzDm3ED https://t.co/BcB3wLjILg,2017-07-05,56
On behalf of @FLOTUS Melania and myself thank you Poland!???§???????æ???ñ#ICYMI watch hereƒ?_‹?è https://t.co/COpVXnn8YG #POTUSinPoland https://t.co/ylU3wLZV2H,2017-07-06,56
America is proud to stand shoulder-to-shoulder with Poland in the fight to eradicate the evils of terrorism and extremism. #POTUSinPoland https://t.co/MHxRmVvtsh,2017-07-06,56
THE WEST WILL NEVER BE BROKEN. Our values will PREVAIL. Our people will THRIVE and our civilization will TRIUMPH! https://t.co/sozuVgdp5T,2017-07-06,56
A strong Poland is a blessing to the nations of Europe and a strong Europe is a blessing to the West and to the world. https://t.co/vHzPwMtJSm,2017-07-06,56
My experience yesterday in Poland was a great one. Thank you to everyone including the haters for the great reviews of the speech!,2017-07-07,57
After Poland had a great meeting with Chancellor Merkel and then with PM Shinzèç Abe of Japan &amp; President Moon of South Korea.,2017-07-07,57
Everyone here is talking about why John Podesta refused to give the DNC server to the FBI and the CIA. Disgraceful!,2017-07-07,57
I look forward to all meetings today with world leaders including my meeting with Vladimir Putin. Much to discuss.#G20Summit #USA???§????,2017-07-07,57
I will represent our country well and fight for its interests! Fake News Media will never cover me accurately but who cares! We will #MAGA!,2017-07-07,57
Thank you! ƒ??Trumpƒ??s Defining Speechƒ?ù WSJ Editorial: https://t.co/YuDgVfRroR https://t.co/T0R4u4IHDJ,2017-07-07,57
Great first day with world leaders at the #G20Summit here in Hamburg Germany. Looking forward to day two! #USA https://t.co/bLKgZKQemw,2017-07-07,57
We will fight the #FakeNews with you! https://t.co/zOMiXTeLJq,2017-07-08,57
The #G20Summit was a wonderful success and carried out beautifully by Chancellor Angela Merkel. Thank you!,2017-07-08,57
Law enforcement &amp; military did a spectacular job in Hamburg. Everybody felt totally safe despite the anarchists. @PolizeiHamburg #G20Summit,2017-07-08,57
Leaving Hamburg for Washington D.C. and the WH. Just left Chinaƒ??s President Xi where we had an excellent meeting on trade &amp; North Korea.,2017-07-08,57
Thank you @SenatorDole very kind! https://t.co/cXrYiK46Qq,2017-07-09,57
The G 20 Summit was a great success for the U.S. - Explained that the U.S. must fix the many bad trade deals it has made. Will get done!,2017-07-09,57
