text,created_at,Unique Identifier
It all begins today! I will see you at 11:00 A.M. for the swearing-in. THE MOVEMENT CONTINUES - THE WORK BEGINS!,2017-01-20,1
Today we are not merely transferring power from one Administration to another or from one party to another ƒ?? but we are transferring...,2017-01-20,1
power from Washington D.C. and giving it back to you the American People. #InaugurationDay,2017-01-20,1
What truly matters is not which party controls our government but whether our government is controlled by the people.,2017-01-20,1
January 20th 2017 will be remembered as the day the people became the rulers of this nation again.,2017-01-20,1
The forgotten men and women of our country will be forgotten no longer. From this moment on itƒ??s going to be #AmericaFirst???§????,2017-01-20,1
We will bring back our jobs. We will bring back our borders. We will bring back our wealth - and we will bring back our dreams!,2017-01-20,1
We will follow two simple rules: BUY AMERICAN &amp; HIRE AMERICAN!#InaugurationDay #MAGA???§????,2017-01-20,1
It is time to remember that...https://t.co/ZKyOiOor62,2017-01-20,1
So to all Americans in every city near and far small and large from mountain to mountain...https://t.co/cZKkrGXLSi,2017-01-20,1
TO ALL AMERICANS???§????https://t.co/D7Es6ie4fY,2017-01-20,1
THANK YOU for another wonderful evening in Washington D.C. TOGETHER we will MAKE AMERICA GREAT AGAIN???§???? https://t.co/V3aoj9RUh4,2017-01-21,1
A fantastic day and evening in Washington D.C.Thank you to @FoxNews and so many other news outlets for the GREAT reviews of the speech!,2017-01-21,1
"RT @WhiteHouse: ""Do not allow anyone to tell you that it cannot be done. No challenge can match the HEART and FIGHT and SPIRIT of America.""ƒ??",2017-01-21,1
Had a great meeting at CIA Headquarters yesterday packed house paid great respect to Wall long standing ovations amazing people. WIN!,2017-01-22,1
Watched protests yesterday but was under the impression that we just had an election! Why didn't these people vote? Celebs hurt cause badly.,2017-01-22,1
Wow television ratings just out: 31 million people watched the Inauguration 11 million more than the very good ratings from 4 years ago!,2017-01-22,1
Peaceful protests are a hallmark of our democracy. Even if I don't always agree I recognize the rights of people to express their views.,2017-01-22,1
Busy week planned with a heavy focus on jobs and national security. Top executives coming in at 9:00 A.M. to talk manufacturing in America.,2017-01-23,2
Will be meeting at 9:00 with top automobile executives concerning jobs in America. I want new plants to be built here for cars sold here!,2017-01-24,2
A photo delivered yesterday that will be displayed in the upper/lower press hall. Thank you Abbas! https://t.co/Uzp0ivvRp0,2017-01-24,2
Great meeting with automobile industry leaders at the @WhiteHouse this morning. Together we will #MAGA! https://t.co/OXdiLOkGsZ,2017-01-24,2
Signing orders to move forward with the construction of the Keystone XL and Dakota Access pipelines in the Oval Offƒ?? https://t.co/aOxmfO0vOK,2017-01-24,2
Great meeting with Ford CEO Mark Fields and General Motors CEO Mary Barra at the @WhiteHouse today. https://t.co/T0eIgO6LP8,2017-01-25,2
Congratulations to @FoxNews for being number one in inauguration ratings. They were many times higher than FAKE NEWS @CNN - public is smart!,2017-01-25,2
"If Chicago doesn't fix the horrible ""carnage"" going on 228 shootings in 2017 with 42 killings (up 24% from 2016) I will send in the Feds!",2017-01-25,2
Big day planned on NATIONAL SECURITY tomorrow. Among many other things we will build the wall!,2017-01-25,2
I will be asking for a major investigation into VOTER FRAUD including those registered to vote in two states those who are illegal and....,2017-01-25,2
even those registered to vote who are dead (and many for a long time). Depending on results we will strengthen up voting procedures!,2017-01-25,2
I will be making my Supreme Court pick on Thursday of next week.Thank you!,2017-01-25,2
I will be interviewed by @DavidMuir tonight at 10 o'clock on @ABC. Will be my first interview from the White House.ƒ?? https://t.co/4zuOrRdcoc,2017-01-25,2
Beginning today the United States of America gets back control of its borders. Full speech from today @DHSgov:ƒ?? https://t.co/8aDaHsAhg9,2017-01-26,3
As your President I have no higher duty than to protect the lives of the American people. https://t.co/o7YNUNwb8f,2017-01-26,3
@romoabcnews: .@DavidMuir first @POTUS interview since taking office.  Tonight on @ABCWorldNews @ABC2020 tonight. https://t.co/I4Vz1mRdBK,2017-01-26,3
Interview with David Muir of @ABC News in 10 minutes. Enjoy!,2017-01-26,3
Ungrateful TRAITOR Chelsea Manning who should never have been released from prison is now calling President Obama a weak leader. Terrible!,2017-01-26,3
The U.S. has a 60 billion dollar trade deficit with Mexico. It has been a one-sided deal from the beginning of NAFTA with massive numbers...,2017-01-26,3
of jobs and companies lost. If Mexico is unwilling to pay for the badly needed wall then it would be better to cancel the upcoming meeting.,2017-01-26,3
Spoke at the Congressional @GOP Retreat in Philadelphia PA. this afternoon w/ @VP @SenMajLeader @SpeakerRyan. Thƒ?? https://t.co/s4sTbSyBSR,2017-01-26,3
Spoke at the Congressional @GOP Retreat in Philadelphia PA. this afternoon w/ @VP @SenateMajLdr @SpeakerRyan. Thƒ?? https://t.co/ALSADGrwoe,2017-01-26,3
Will be interviewed by @SeanHannity on @FoxNews at 10:00pm tonight. Enjoy!,2017-01-26,3
Miami-Dade Mayor drops sanctuary policy. Right decision. Strong! https://t.co/MtPvaDC4jM,2017-01-26,3
Look forward to seeing final results of VoteStand. Gregg Phillips and crew say at least 3000000 votes were illegal. We must do better!,2017-01-27,3
Mexico has taken advantage of the U.S. for long enough. Massive trade deficits &amp; little help on the very weak border must change NOW!,2017-01-27,3
The #MarchForLife is so important. To all of you marching --- you have my full support!,2017-01-27,3
.@VP Mike Pence will be speaking at today's #MarchForLife -- You have our full support! https://t.co/1jb53SEGV4,2017-01-27,3
Statement on International Holocaust Remembrance Day: https://t.co/KjU0MOxCHk,2017-01-27,3
Congratulations Secretary Mattis! https://t.co/mkuhbegzqS,2017-01-27,3
I promise that our administration will ALWAYS have your back. We will ALWAYS be with you! https://t.co/D0aOWhOH4X,2017-01-27,3
The failing @nytimes has been wrong about me from the very beginning. Said I would lose the primaries then the general election. FAKE NEWS!,2017-01-28,3
Thr coverage about me in the @nytimes and the @washingtonpost gas been so false and angry that the times actually apologized to its.....,2017-01-28,3
...dwindling subscribers and readers.They got me wrong right from the beginning and still have not changed course and never will. DISHONEST,2017-01-28,3
Today we remember the crew of the Space Shuttle Challenger 31 years later. #NeverForget https://t.co/OhshQsFRfl,2017-01-28,3
I will be interviewed by @TheBrodyFile on @CBNNews tonight at 11pm. Enjoy!,2017-01-28,3
Somebody with aptitude and conviction should buy the FAKE NEWS and failing @nytimes and either run it correctly or let it fold with dignity!,2017-01-29,4
Our country needs strong borders and extreme vetting NOW. Look what is happening all over Europe and indeed the world - a horrible mess!,2017-01-29,4
Christians in the Middle-East have been executed in large numbers. We cannot allow this horror to continue!,2017-01-29,4
The joint statement of former presidential candidates John McCain &amp; Lindsey Graham is wrong - they are sadly weak on immigration. The two...,2017-01-29,4
...Senators should focus their energies on ISIS illegal immigration and border security instead of always looking to start World War III.,2017-01-29,4
Statement Regarding Recent Executive Order Concerning Extreme Vetting: https://t.co/f6JO60I0Ul,2017-01-29,4
I will be interviewed by @TheBrodyFile on @CBNNews tonight at 11pm. Enjoy!,2017-01-29,4
Only 109 people out of 325000 were detained and held for questioning. Big problems at airports were caused by Delta computer outage.....,2017-01-30,4
protesters and the tears of Senator Schumer. Secretary Kelly said that all is going well with very few problems. MAKE AMERICA SAFE AGAIN!,2017-01-30,4
There is nothing nice about searching for terrorists before they can enter our country. This was a big part of my campaign. Study the world!,2017-01-30,4
"If the ban were announced with a one week notice the ""bad"" would rush into our country during that week. A lot of bad ""dudes"" out there!",2017-01-30,4
I have made my decision on who I will nominate for The United States Supreme Court. It will be announced live on Tuesday at 8:00 P.M. (W.H.),2017-01-30,4
Where was all the outrage from Democrats and the opposition party (the media) when our jobs were fleeing our country?,2017-01-30,4
The American dream is back. Weƒ??re going to create an environment for small business like we havenƒ??t had in many maƒ?? https://t.co/Bh7SrNEgz1,2017-01-30,4
The Democrats are delaying my cabinet picks for purely political reasons. They have nothing going but to obstruct. Now have an Obama A.G.,2017-01-31,4
Nancy Pelosi and Fake Tears Chuck Schumer held a rally  at the steps of The Supreme Court and mic did not work (a mess)-just like Dem party!,2017-01-31,4
When will the Democrats give us our Attorney General and rest of Cabinet! They should be ashamed of themselves! No wonder D.C. doesn't work!,2017-01-31,4
Getting ready to deliver a VERY IMPORTANT DECISION!  8:00 P.M.,2017-02-01,5
Join me live from the @WhiteHouse.https://t.co/LHOs4nAaGl,2017-02-01,5
Hope you like my nomination of Judge Neil Gorsuch for the United States Supreme Court. He is a good and brilliant man respected by all.,2017-02-01,5
Everybody is arguing whether or not it is a BAN. Call it what you want it is about keeping bad people (with bad intentions) out of country!,2017-02-01,5
Iran is rapidly taking over more and more of Iraq even after the U.S. has squandered three trillion dollars there. Obvious long ago!,2017-02-02,5
Do you believe it? The Obama Administration agreed to take thousands of illegal immigrants from Australia. Why? I will study this dumb deal!,2017-02-02,5
If U.C. Berkeley does not allow free speech and practices violence on innocent people with a different point of view - NO FEDERAL FUNDS?,2017-02-02,5
Congratulations to Rex Tillerson on being sworn in as our new Secretary of State. He will be a star!,2017-02-02,5
Attending Chief Ryan Owens' Dignified Transfer yesterday with my daughter Ivanka was my great honor. To a great and brave man - thank you!,2017-02-02,5
Iran has been formally PUT ON NOTICE for firing a ballistic missile.Should have been thankful for the terrible deal the U.S. made with them!,2017-02-02,5
Iran was on its last legs and ready to collapse until the U.S. came along and gave it a life-line in the form of the Iran Deal: $150 billion,2017-02-02,5
Thank you @Samsung! We would love to have you! https://t.co/r5nxC9oOA4,2017-02-02,5
Yes Arnold Schwarzenegger did a really bad job as Governor of California and even worse on the Apprentice...but at least he tried hard!,2017-02-03,5
"Iran is playing with fire - they don't appreciate how ""kind"" President Obama was to them. Not me!",2017-02-03,5
Thank you to Prime Minister of Australia for telling the truth about our very civil conversation that FAKE NEWS media lied about. Very nice!,2017-02-03,5
Meeting with biggest business leaders this morning. Good jobs are coming back to U.S. health care and tax bills are being crafted NOW!,2017-02-03,5
Professional anarchists thugs and paid protesters are proving the point of the millions of people who voted to MAKE AMERICA GREAT AGAIN!,2017-02-03,5
A new radical Islamic terrorist has just attacked in Louvre Museum in Paris. Tourists were locked down. France on edge again. GET SMART U.S.,2017-02-03,5
"We must keep ""evil"" out of our country!",2017-02-03,5
Countries charge U.S. companies taxes or tariffs while the U.S. charges them nothing or little.We should charge them SAME as they charge us!,2017-02-04,6
When a country is no longer able to say who can and who cannot  come in &amp; out especially for reasons of safety &amp;.security - big trouble!,2017-02-04,6
Interesting that certain Middle-Eastern countries agree with the ban. They know if certain people are allowed in it's death &amp; destruction!,2017-02-04,6
The opinion of this so-called judge which essentially takes law-enforcement away from our country is ridiculous and will be overturned!,2017-02-04,6
After being forced to apologize for its bad and inaccurate coverage of me after winning the election the FAKE NEWS @nytimes is still lost!,2017-02-04,6
MAKE AMERICA GREAT AGAIN!,2017-02-04,6
What is our country coming to when a judge can halt a Homeland Security travel ban and anyone even with bad intentions can come into U.S.?,2017-02-04,6
Because the ban was lifted by a judge many very bad and dangerous people may be pouring into our country. A terrible decision,2017-02-04,6
Why aren't the lawyers looking at and using the Federal Court decision in Boston which is at conflict with ridiculous lift ban decision?,2017-02-04,6
Interview with @oreillyfactor on Fox Network - 4:00 P.M. (prior to Super Bowl). Enjoy!,2017-02-05,6
The judge opens up our country to potential terrorists and others that do not have our best interests at heart. Bad people are very happy!,2017-02-05,6
Just cannot  believe a judge would put our country in such peril. If something happens blame him and court system. People pouring in. Bad!,2017-02-05,6
I have instructed Homeland Security to check people coming into our country VERY CAREFULLY. The courts are making the job very difficult!,2017-02-05,6
I will be interviewed by @oreillyfactor at 4:00 P.M. (prior to the #SuperBowl Pre-game Show) on Fox Network. Enjoy!,2017-02-05,6
Enjoy the #SuperBowl and then we continue: MAKE AMERICA GREAT AGAIN!,2017-02-05,6
What an amazing comeback and win by the Patriots. Tom Brady Bob Kraft and Coach B are total winners. Wow!,2017-02-06,6
Any negative polls are fake news just like the CNN ABC NBC polls in the election. Sorry people want border security and extreme vetting.,2017-02-06,6
I call my own shots largely based on an accumulation of data and everyone knows it. Some FAKE NEWS media in order to marginalize lies!,2017-02-06,6
Will be interviewed on @oreillyfactor tonight at 8:00 P.M.,2017-02-06,6
The failing @nytimes writes total fiction concerning me. They have gotten it wrong for two years and now are making up stories &amp; sources!,2017-02-06,6
An extended interview from the Super Bowl with @oreillyfactor airs tonight at 8:00 P.M. Enjoy! https://t.co/kZdHqaNTVR,2017-02-06,6
The failing @nytimes was forced to apologize to its subscribers for the poor reporting it did on my election win. Now they are worse!,2017-02-07,7
The threat from radical Islamic terrorism is very real just look at what is happening in Europe and the Middle-East. Courts must act fast!,2017-02-07,7
I don't know Putin have no deals in Russia and the haters are going crazy - yet Obama can make a deal with Iran #1in terror no problem!,2017-02-07,7
I don't know Putin have no deals in Russia and the haters are going crazy - yet Obama can make a deal with Iran #1 in terror no problem!,2017-02-07,7
An honor having the National Sheriffs' Assoc. join me at the @WhiteHouse. Incredible men &amp; women who protect &amp; servƒ?? https://t.co/1LkhbCNh8L,2017-02-07,7
It is a disgrace that my full Cabinet is still not in place the longest such delay in the history of our country. Obstruction by Democrats!,2017-02-08,7
If the U.S. does not win this case as it so obviously should we can never have the security and safety to which we are entitled. Politics!,2017-02-08,7
I will be speaking at 9:00 A.M. today to Police Chiefs and Sheriffs and will be discussing the horrible dangerous and wrong decision.......,2017-02-08,7
Thank you to our great Police Chiefs &amp; Sheriffs for your leadership &amp; service. You have a true friend in theƒ?? https://t.co/Lysnv8ZR1h,2017-02-08,7
My daughter Ivanka has been treated so unfairly by @Nordstrom. She is a great person -- always pushing me to do the right thing! Terrible!,2017-02-08,7
'16 Fake News Stories Reporters Have Run Since Trump Won' https://t.co/0dHld5kiVc,2017-02-08,7
Big increase in traffic into our country from certain areas while our people are far more vulnerable as we wait for what should be EASY D!,2017-02-08,7
Thank you Brian Krzanich CEO of @Intel. A great investment ($7 BILLION) in American INNOVATION and JOBS!ƒ?? https://t.co/oicfDsPKHQ,2017-02-08,7
'Immigration Ban Is One Of Trump's Most Popular Orders So Far' https://t.co/wAelwuQ4BE,2017-02-08,7
'Majority in Leading EU Nations Support Trump-Style Travel Ban' Poll of more than 10000 people in 10 countries...https://t.co/KWsIWhtC9o,2017-02-08,7
'Trump administration seen as more truthful than news media'https://t.co/6LmsR5JOSW,2017-02-08,7
Congratulations to our new Attorney General @SenatorSessions! https://t.co/e0buP1K83z,2017-02-09,7
Sen.Richard Blumenthal who never fought in Vietnam when he said for years he had (major lie)now misrepresents what Judge Gorsuch told him?,2017-02-09,7
"Chris Cuomo in his interview with Sen. Blumenthal never asked him about his long-term lie about his brave ""service"" in Vietnam. FAKE NEWS!",2017-02-09,7
Sen. McCain should not be talking about the success or failure of a mission to the media. Only emboldens the enemy! He's been losing so....,2017-02-09,7
...long he doesn't know how to win anymore just look at the mess our country is in - bogged down in conflict all over the place. Our hero..,2017-02-09,7
"..Ryan died on a winning mission ( according to General Mattis) not a ""failure."" Time for the U.S. to get smart and start winning again!",2017-02-09,7
Join us live in the Oval Office for the swearing in of our new Attorney General @SenatorSessions!LIVE:ƒ?? https://t.co/QeW6vjog4A,2017-02-09,7
SEE YOU IN COURT THE SECURITY OF OUR NATION IS AT STAKE!,2017-02-09,7
"LAWFARE: ""Remarkably in the entire opinion the panel did not bother even to cite this (the) statute."" A disgraceful decision!",2017-02-10,8
"The failing @nytimes does major FAKE NEWS China story saying ""Mr.Xi has not spoken to Mr. Trump since Nov.14."" We spoke at length yesterday!",2017-02-10,8
Heading to Joint Base Andrews on #MarineOne with Prime Minister Shinzèç earlier today. https://t.co/4JFhyYdeHO,2017-02-10,8
"Our legal system is broken! ""77% of refugees allowed into U.S. since travel reprieve hail from seven suspect countries."" (WT)  SO DANGEROUS!",2017-02-11,8
I am reading that the great border WALL will cost more than the government originally thought but I have not gotten involved in the.....,2017-02-11,8
...design or negotiations yet. When I do just like with the F-35 FighterJet or the Air Force One Program price will come WAY DOWN!,2017-02-11,8
Melania and I are hosting Japanese Prime Minister Shinzo Abe and Mrs. Abe at Mar-a-Lago in Palm Beach Fla. They are a wonderful couple!,2017-02-11,8
Having a great time hosting Prime Minister Shinzo Abe in the United States! https://t.co/Fvjsac89qSƒ?? https://t.co/hKqbMB2aQ9,2017-02-11,8
I am so proud of my daughter Ivanka. To be abused and treated so badly by the media and to still hold her head so high is truly wonderful!,2017-02-11,8
Playef golf today with Prime Minister Abe of Japan and @TheBig_Easy Ernie Els and had a great time. Japan is very well represented!,2017-02-11,8
Played golf today with Prime Minister Abe of Japan and @TheBig_Easy Ernie Els and had a great time. Japan is very well represented!,2017-02-11,8
A working dinner tonight with Prime Minister Abe of Japan and his representatives at the Winter White House (Mar-a-Lago). Very good talks!,2017-02-11,8
RT @Scavino45: LIVE Joint Statement by President Trump and Prime Minister Shinzo Abe: https://t.co/c3Fe5cUaaS,2017-02-12,8
#ICYMI: Joint Statement with Prime Minister Shinzo Abe on North Korea. https://t.co/qEC87FKB1D,2017-02-12,8
The crackdown on illegal criminals is merely the keeping of my campaign promise. Gang members drug dealers &amp; others are being removed!,2017-02-12,8
72% of refugees admitted into U.S. (2/3 -2/11) during COURT BREAKDOWN are from 7 countries: SYRIA IRAQ SOMALIA IRAN SUDAN LIBYA &amp; YEMEN,2017-02-12,8
While on FAKE NEWS @CNN Bernie Sanders was cut off for using the term fake news to describe the network. They said technical difficulties!,2017-02-12,8
After two days of very productive talks Prime Minister Abe is heading back to Japan. L,2017-02-12,8
I know Mark Cuban well. He backed me big-time but I wasn't interested in taking all of his calls.He's not smart enough to run for president!,2017-02-12,8
Congratulations Stephen Miller- on representing me this morning on the various Sunday morning shows. Great job!,2017-02-12,8
Just leaving Florida. Big crowds of enthusiastic supporters lining the road that the FAKE NEWS media refuses to mention. Very dishonest!,2017-02-12,8
Today I will meet with Canadian PM Trudeau and a group of leading business women to discuss women in the workforce. https://t.co/bFAHPRXHdP,2017-02-13,9
Welcome to the @WhiteHouse Prime Minister @JustinTrudeau! https://t.co/WKgF8Zo9ri,2017-02-13,9
Wonderful meeting with Canadian PM @JustinTrudeau and a group of leading CEO's &amp; business women from Canada????????and thƒ?? https://t.co/wAoCOaYeZ6,2017-02-13,9
Congratulations Treasury Secretary Steven Mnuchin! #ICYMI- watch here: https://t.co/RPsmw4yD7y https://t.co/K8tWLlXiYK,2017-02-14,9
Congratulations to our new #VASecretary Dr. David Shulkin. Time to take care of Veterans who have fought to protectƒ?? https://t.co/FNewjbHuw4,2017-02-14,9
The real story here is why are there so many illegal leaks coming out of Washington? Will these leaks be happening as I deal on N.Korea etc?,2017-02-14,9
Great parent-teacher listening session this morning with @VP Pence &amp; @usedgov Secretary @BetsyDeVos. Watch:ƒ?? https://t.co/nuLTs513Ot,2017-02-14,9
'Remarks by President Trump at Signing of H.J. Resolution 41'https://t.co/Q3MoCGAc54 https://t.co/yGDDTKm9Br,2017-02-14,9
Obamacare continues to fail. Humana to pull out in 2018. Will repeal replace &amp; save healthcare for ALL Americans. https://t.co/glWEQ0lNR4,2017-02-14,9
The fake news media is going crazy with their conspiracy theories and blind hatred. @MSNBC &amp; @CNN are unwatchable. @foxandfriends is great!,2017-02-15,9
This Russian connection non-sense is merely an attempt to cover-up the many mistakes made in Hillary Clinton's losing campaign.,2017-02-15,9
Information is being illegally given to the failing @nytimes &amp; @washingtonpost by the intelligence community (NSA and FBI?).Just like Russia,2017-02-15,9
"Thank you to Eli Lake of The Bloomberg View - ""The NSA &amp; FBI...should not interfere in our politics...and is"" Very serious situation for USA",2017-02-15,9
Crimea was TAKEN by Russia during the Obama Administration. Was Obama too soft on Russia?,2017-02-15,9
"The real scandal here is that classified information is illegally given out by ""intelligence"" like candy. Very un-American!",2017-02-15,9
Great listening session with CEO's of the Retail Industry Leaders Association this morning! https://t.co/sy6xJcWfcF,2017-02-15,9
Welcome to the United States @IsraeliPM Benjamin &amp; Sara!#ICYMI???§???????????ñJoint Press Conference: https://t.co/GN6ALWUusN https://t.co/bH60nBL5FP,2017-02-15,9
Join me in Florida this Saturday at 5pm for a rally at the Orlando-Melbourne International Airport!Tickets:ƒ?? https://t.co/OigfXFECPp,2017-02-15,9
Aetna CEO: Obamacare in 'Death Spiral' #RepealAndReplace https://t.co/dmHL7xIEQv,2017-02-15,9
Venezuela should allow Leopoldo Lopez a political prisoner &amp; husband of @liliantintori (just met w/ @marcorubio) oƒ?? https://t.co/HhgE51dtSN,2017-02-15,9
Stock market hits new high with longest winning streak in decades. Great level of confidence and optimism - even before tax plan rollout!,2017-02-16,10
Leaking and even illegal classified leaking has been a big problem in Washington for years. Failing @nytimes (and others) must apologize!,2017-02-16,10
The spotlight has finally been put on the low-life leakers! They will be caught!,2017-02-16,10
"FAKE NEWS media which makes up stories and ""sources"" is far more effective than the discredited Democrats - but they are fading fast!",2017-02-16,10
The Democrats had to come up with a story as to why they lost the election and so badly (306) so they made up a story - RUSSIA. Fake news!,2017-02-16,10
'Trump signs bill undoing Obama coal mining rule' https://t.co/yMfT5r5RGh,2017-02-16,10
Despite the long delays by the Democrats in finally approving Dr. Tom Price the repeal and replacement of ObamaCare is moving fast!,2017-02-17,10
Going to Charleston South Carolina in order to spend time with Boeing and talk jobs! Look forward to it.,2017-02-17,10
Thank you for all of the nice statements on the Press Conference yesterday. Rush Limbaugh said one of greatest ever. Fake media not happy!,2017-02-17,10
General Keith Kellogg who I have known for a long time is very much in play for NSA - as are three others.,2017-02-17,10
Join me at 11:00am:Watch here: https://t.co/veqKmsGAwf https://t.co/UzndIjIqjM,2017-02-17,10
The FAKE NEWS media (failing @nytimes @CNN @NBCNews and many more)    is not my enemy it is the enemy of the American people. SICK!,2017-02-17,10
The FAKE NEWS media (failing @nytimes @NBCNews @ABC @CBS @CNN) is not my enemy it is the enemy of the American People!,2017-02-17,10
