text,created_at,Unique Identifier
RT @hughhewitt: @realDonaldTrump I spoke to a group of influential CA GOPers tonight long time activists bundlers influencers. Support fƒ??,2017-08-18,71
I have directed that U.S. Cyber Command be elevated to the status of a Unified Combatant Command focused on....cont: https://t.co/3iScfuMw9s,2017-08-18,71
Just returned to Bedminster NJ from Camp David. GREAT meeting on National Security the Border and the Military! #MAGA???§???? https://t.co/Hjmcnnse9j,2017-08-18,71
Today I signed the Global War on Terrorism War Memorial Act (#HR873.) The bill authorizes....contƒ?_‹?èhttps://t.co/c3zIkdtowc https://t.co/re6n0MS0cj,2017-08-19,71
My thoughts and prayers are with the @KissimmeePolice and their loved ones. We are with you!#LESM,2017-08-19,71
I want to thank Steve Bannon for his service. He came to the campaign during my run against Crooked Hillary Clinton - it was great! Thanks S,2017-08-19,71
Important day spent at Camp David with our very talented Generals and military leaders. Many decisions made including on Afghanistan.,2017-08-19,71
Steve Bannon will be a tough and smart new voice at @BreitbartNews...maybe even better than ever before. Fake News needs the competition!,2017-08-19,71
Looks like many anti-police agitators in Boston. Police are looking tough and smart! Thank you.,2017-08-19,71
Great job by all law enforcement officers and Boston Mayor @Marty_Walsh.,2017-08-19,71
Our great country has been divided for decades. Sometimes you need protest in order to heel &amp; we will heel &amp; be stronger than ever before!,2017-08-19,71
Our great country has been divided for decades. Sometimes you need protest in order to heal &amp; we will heal &amp; be stronger than ever before!,2017-08-19,71
I want to applaud the many protestors in Boston who are speaking out against bigotry and hate. Our country will soon come together as one!,2017-08-19,71
Heading back to Washington after working hard and watching some of the worst and most dishonest Fake News reporting I have ever seen!,2017-08-20,71
Thoughts &amp; prayers are w/ our @USNavy sailors aboard the #USSJohnSMcCain where search &amp; rescue efforts are underway. https://t.co/DQU0zTRXNU,2017-08-21,72
Jerry Falwell of Liberty University was fantastic on @foxandfriends. The Fake News should listen to what he had to say. Thanks Jerry!,2017-08-21,72
Thank you the very dishonest Fake News Media is out of control! https://t.co/8J7y900VGK,2017-08-21,72
Join me live from Fort Myer in Arlington Virginia. ƒ?_‹?èhttps://t.co/LOV4StdJDj,2017-08-22,72
RT @marcorubio: Good #AfghanStrategy &amp; excellent speech by @POTUS laying it out to the nation.,2017-08-22,72
Thank you to the men and women of Fort Myer and every member of the U.S. Military at home and abroad. #USA???§???? https://t.co/ticezYKkhz,2017-08-22,72
Address to the NationFull Video &amp; Transcript:https://t.co/FELdImTuUM https://t.co/6ly3fNatiX,2017-08-22,72
Was with great people last night in Fort Myer Virginia. The future of our country is strong!,2017-08-22,72
We pray for our fallen heroes who died while serving our country in the @USNavy aboard the  #USSJohnSMcCain and their families. https://t.co/t3kD8qj9Mt,2017-08-22,72
See you at 7:00 P.M. tonight Phoenix Arizona! #MAGA???§????Tickets: https://t.co/2kUQfKqbsx https://t.co/1w3LVkpESE,2017-08-22,72
We will push onward to victory w/hope in our hearts courage in our souls &amp; everlasting pride in each &amp; every one of you. God Bless America. https://t.co/44QYFSq07a,2017-08-22,72
THANK YOU to all of the great men and women at the U.S. Customs and Border Protection facility in Yuma Arizona &amp; around the United States! https://t.co/tjFx8XjhDz,2017-08-23,72
Thank you Arizona. Beautiful turnout of 15000 in Phoenix tonight! Full coverage of rally via my Facebook at: https://t.co/s0D12EFs40 https://t.co/WT4D9Vsen1,2017-08-23,72
Not only does the media give a platform to hate groups but the media turns a blind eye to the gang violence on our streets! https://t.co/Mau0B1qYIP,2017-08-23,72
#DrainTheSwamp #PhoenixRally https://t.co/o7S6xoCBiC,2017-08-23,72
MAKE AMERICA GREAT AGAIN! https://t.co/RzePiucV3h,2017-08-23,72
Phoenix crowd last night was amazing - a packed house. I love the Great State of Arizona. Not a fan of Jeff Flake weak on crime &amp; border!,2017-08-23,72
Last night in Phoenix I read the things from my statements on Charlottesville that the Fake News Media didn't cover fairly. People got it!,2017-08-23,72
If Republican Senate doesn't get rid of the Filibuster Rule &amp; go to a simple majority which the Dems would do they are just wasting time!,2017-08-23,72
As long as we have faith in each other and confidence in our values then there is no challenge too great for us to conquer! #ALConv2017 https://t.co/tsIAgHbFM7,2017-08-23,72
A great honor to sign the Veterans Appeals Improvement &amp; Modernization Act into law w/ @AmericanLegion @SecShulkin.???ùhttps://t.co/fr2sf9oRvd https://t.co/bICsRm1tQx,2017-08-23,72
Donald E. Ballard on behalf of the people of the United States THANK YOU for your courageous service. YOU INSPIRE US ALL! #ALConv2017 https://t.co/46m20cJkLB,2017-08-24,73
I requested that Mitch M &amp; Paul R tie the Debt Ceiling legislation into the popular V.A. Bill (which just passed) for easy approval. They...,2017-08-24,73
...didn't do it so now we have a big deal with Dems holding them up (as usual) on Debt Ceiling approval. Could have been so easy-now a mess!,2017-08-24,73
RT @JerryTravone: @realDonaldTrump  https://t.co/6XJxEg1gSs,2017-08-24,73
The Fake News is now complaining about my different types of back to back speeches. Well their was Afghanistan (somber) the big Rally.....,2017-08-24,73
...(enthusiastic dynamic and fun) and the American Legion - V.A. (respectful and strong).To bad the Dems have no one who can change tones!,2017-08-24,73
The Fake News is now complaining about my different types of back to back speeches. Well there was Afghanistan (somber) the big Rally.....,2017-08-24,73
...(enthusiastic dynamic and fun) and the American Legion - V.A. (respectful and strong). To bad the Dems have no one who can change tones!,2017-08-24,73
James Clapper who famously got caught lying to Congress is now an authority on Donald Trump. Will he show you his beautiful letter to me?,2017-08-24,73
..(enthusiastic dynamic and fun) and the American Legion - V.A. (respectful and strong). Too bad the Dems have no one who can change tones!,2017-08-24,73
James Clapper who famously got caught lying to Congress is now an authority on Donald Trump. Will he show you his beautiful letter to me?,2017-08-24,73
The only problem I have with Mitch McConnell is that after hearing Repeal &amp; Replace for 7 years he failed!That should NEVER have happened!,2017-08-24,73
On Tuesday I visited with the incredible men &amp; women of @ICEgov &amp; @DHSgov Border Patrol in Yuma AZ. Thank you. We respect &amp; cherish you! https://t.co/KSQddGqWzJ,2017-08-24,73
As #HurricaneHarvey intensifies - remember to #PlanAhead. ƒ??‹?èhttps://t.co/FMdmvohypyƒ??‹?èhttps://t.co/YL56ldeqoW ƒ??‹?èhttps://t.co/t1s4AL3B47 https://t.co/tpXmOK70ug,2017-08-24,73
A great honor to spend time with our brave HEROES at the @USMC Air Station Yuma. THANK YOU for your service to the United Staes of America! https://t.co/FUtGBoTJLo,2017-08-24,73
A GREAT HONOR to spend time with our BRAVE HEROES at the @USMC Air Station Yuma. THANK YOU for your service to the United States of America! https://t.co/4lJ94nxODu,2017-08-25,73
RT @GregAbbott_TX: Spoke with Pres. Trump &amp; heads of Homeland Security &amp; FEMA. They're helping Texas respond to #HurricaneHarvey. https://tƒ??,2017-08-25,73
RT @EricTrump: Honored to speak at the RNC Summer Meeting in Nashville Tennessee this evening! @GOP #MAGA @GOPChairwoman ???§???????§???????§???? https://t.cƒ??,2017-08-25,73
If Senate Republicans don't get rid of the Filibuster Rule and go to a 51% majority few bills will be passed. 8 Dems control the Senate!,2017-08-25,73
General John Kelly is doing a fantastic job as Chief of Staff. There is tremendous spirit and talent in the W.H. Don't believe the Fake News,2017-08-25,73
Few if any Administrations have done more in just 7 months than the Trump A. Bills passed regulations killed border military ISIS SC!,2017-08-25,73
"Nick Adams ""Retaking America""  ""Best things of this presidency aren't reported about. Convinced this will be perhaps best presidency ever.""",2017-08-25,73
Strange statement by Bob Corker considering that he is constantly asking me whether or not he should run again in '18. Tennessee not happy!,2017-08-25,73
I have spoken w/ @GovAbbott of Texas and @LouisianaGov Edwards. Closely monitoring #HurricaneHarvey developments &amp; here to assist as needed.,2017-08-25,73
Received a #HurricaneHarvey briefing this morning from Acting @DHSgov Secretary Elaine Duke @FEMA_Brock @TomBossert45 and COS John Kelly. https://t.co/cnkRZd6D6Z,2017-08-25,73
I encourage everyone in the path of #HurricaneHarvey to heed the advice &amp; orders of their local and state officials. https://t.co/N6uEWCZUrv,2017-08-25,73
Just arrived at Camp David where I am closely watching the path and doings of Hurricane Harvey as it strengthens to a Category 3. BE SAFE!,2017-08-25,73
Just arrived at Camp David where I am monitoring the path and doings of Hurricane Harvey (as it strengthens to a Class 3). 125 MPH winds!,2017-08-25,73
Storm turned Hurricane is getting much bigger and more powerful than projected. Federal Government is on site and ready to respond. Be safe!,2017-08-25,73
At the request of the Governor of Texas I have signed the Disaster Proclamation which unleashes the full force of government help!,2017-08-26,73
RT @realDonaldTrump: At the request of the Governor of Texas I have signed the Disaster Proclamation which unleashes the full force of goƒ??,2017-08-26,73
I am pleased to inform you that I have just granted a full Pardon to 85 year old American patriot Sheriff Joe Arpaio. He kept Arizona safe!,2017-08-26,73
We will remain fully engaged w/ open lines of communication as #HurricaneHarvey makes landfall. America is w/ you! @GovAbbott @FEMA @DHSgov https://t.co/PryIqRxgLr,2017-08-26,73
RT @GovAbbott: To ensure your safety ahead of #Harvey heed warnings from local officials &amp; review important safety information. https://t.cƒ??,2017-08-26,73
You are doing a great job - the world is watching! Be safe. https://t.co/PJLdxy3hD9,2017-08-26,73
RT @EPAScottPruitt: Thoughts and prayers for those in Texas &amp; Louisiana. I am closely monitoring #Harvey developments along with @fema &amp; @Eƒ??,2017-08-26,73
RT @VP: All Americans in harms way need to be prepared and should continue visiting https://t.co/2H22XpTtPj for critical updates on #Hurricƒ??,2017-08-26,73
.@ChuckGrassley - got your message loud and clear. We have fantastic people on the ground got there long before #Harvey. So far so good!,2017-08-26,73
Closely monitoring #HurricaneHarvey from Camp David. We are leaving nothing to chance. City State and Federal Govs. working great together!,2017-08-26,73
THANK YOU to all of the great volunteers helping out with #HurricaneHarvey relief in Texas! https://t.co/Ds95oSgo8f,2017-08-26,73
Wonderful coordination between Federal State and Local Governments in the Great State of Texas - TEAMWORK! Record setting rainfall.,2017-08-26,73
A great book by a great guy highly recommended! https://t.co/3jbDDN8YmJ,2017-08-27,74
Great coordination between agencies at all levels of government. Continuing rains and flash floods are being dealt with. Thousands rescued.,2017-08-27,74
Many people are now saying that this is the worst storm/hurricane they have ever seen. Good news is that we have great talent on the ground.,2017-08-27,74
I will be going to Texas as soon as that trip can be made without causing disruption. The focus must be life and safety.,2017-08-27,74
I will also be going to a wonderful state Missouri that I won by a lot in '16. Dem C.M. is opposed to big tax cuts. Republican will win S!,2017-08-27,74
Wow - Now experts are calling #Harvey a once in 500 year flood! We have an all out effort going and going well!,2017-08-27,74
With Mexico being one of the highest crime Nations in the world we must have THE WALL. Mexico will pay for it through reimbursement/other.,2017-08-27,74
We are in the NAFTA (worst trade deal ever made) renegotiation process with Mexico &amp; Canada.Both being very difficultmay have to terminate?,2017-08-27,74
Going to a Cabinet Meeting (tele-conference) at 11:00 A.M. on #Harvey. Even experts have said they've never seen one like this!,2017-08-27,74
Major rescue operations underway!,2017-08-27,74
HISTORIC rainfall in Houston and all over Texas. Floods are unprecedented and more rain coming. Spirit of the people is incredible.Thanks!,2017-08-27,74
RT @DineshDSouza: Finally as if by accident the @washingtonpost breaks down &amp; admits the truth about where the violence is coming from htƒ??,2017-08-28,74
RT @KatiePavlich: Your boss pardoned a traitor who gave U.S. enemies state secrets he also pardoned a terrorist who killed Americans. Sparƒ??,2017-08-28,74
RT @Inspire_Us: No color no religion no nationality should come between us we are all children of God. - Mother Teresa,2017-08-28,74
RT @GregAbbott_TX: Thanks to the Texas National Guard for their help to rescue flooded Texans. #HurricaneHarvey https://t.co/lhpJtAne10,2017-08-28,74
RT @NWSHouston: Historic flooding is still ongoing across the area. If evacuated please DO NOT return home until authorities indicate it iƒ??,2017-08-29,74
RT @TXMilitary: #PhotosFromTheField: Aerial photos from our rescue crews earlier today. #Harvey #TMDHarvey @USNationalGuard https://t.co/fAƒ??,2017-08-29,74
"RT @TheFive: ""Trump just won on law &amp; order and now he's delivering the goods."" -@jessebwatters #thefive",2017-08-29,74
Leaving now for Texas!,2017-08-29,74
.@foxandfriends   We are not looking to fill all of those positions. Don't need many of them - reduce size of government. @IngrahamAngle,2017-08-29,74
RT @BrazoriaCounty: https://t.co/sUTyXBzer9,2017-08-29,74
The U.S. has been talking to North Korea and paying them extortion money for 25 years. Talking is not the answer!,2017-08-30,75
After witnessing first hand the horror &amp; devastation caused by Hurricane Harveymy heart goes out even more so to the great people of Texas!,2017-08-30,75
After reading the false reporting and even ferocious anger in some dying magazines it makes me wonder WHY? All I want to do is #MAGA!,2017-08-30,75
Will be leaving for Missouri soon for a speech on tax cuts and tax reform - so badly needed!,2017-08-30,75
Texas &amp; Louisiana: We are w/ you today we are w/ you tomorrow &amp; we will be w/ you EVERY SINGLE DAY AFTER to restore recover &amp; REBUILD! https://t.co/YQb82K2VSB,2017-08-30,75
RT @IvankaTrump: We must reform our tax code so that all Americans can succeed in our modern economy &amp; achieve the American Dream! #TaxRefoƒ??,2017-08-31,75
First responders have been doing heroic work. Their courage &amp; devotion has saved countless lives ƒ?? they represent the very best of America! https://t.co/I0gvCQLTKO,2017-08-31,75
RT @SecShulkin: Our Mobile Vet Center set up and ready to help #Veterans impacted by #HurricaneHarvey in Corpus Christi. https://t.co/P3qNXƒ??,2017-08-31,75
RT @FoxNews: .@KellyannePolls on Harvey recovery: We hope when it comes to basic Hurricane Harvey funding that we can rely upon a nonpartisƒ??,2017-08-31,75
THANK YOU to all of the incredible HEROES in Texas. America is with you! #TexasStrong https://t.co/8N4ABo9Ihp,2017-08-31,75
Texas is heeling fast thanks to all of the great men &amp; women who have been working so hard. But still so much to do. Will be back tomorrow!,2017-09-01,75
Wow looks like James Comey exonerated Hillary Clinton long before the investigation was over...and so much more. A rigged system!,2017-09-01,75
General John Kelly is doing a great job as Chief of Staff. I could not be happier or more impressed - and this Administration continues to..,2017-09-01,75
...get things done at a record clip. Many big decisions to be made over the coming days and weeks. AMERICA FIRST!,2017-09-01,75
Texas is healing fast thanks to all of the great men &amp; women who have been working so hard. But still so much to do. Will be back tomorrow!,2017-09-01,75
'President Donald J. Trump Proclaims September 3 2017 as a National Day of Prayer' #HurricaneHarvey #PrayForTexas https://t.co/shen5JxChQ https://t.co/MpLB7WpxfT,2017-09-01,75
Stock Market up 5 months in a row!,2017-09-01,75
I will be going to Texas and Louisiana tomorrow with First Lady. Great progress being made! Spending weekend working at White House.,2017-09-02,76
On behalf of @FLOTUS Melania &amp; myself THANK YOU for today's update &amp; GREAT WORK! #SouthernBaptist @SendRelief @RedCross &amp; @SalvationArmyUS https://t.co/DLgFNiCxN2,2017-09-02,76
Departing for Texas and Louisiana with @FLOTUS Melania right now @JBA_NAFW. We will see you soon. America is with you! https://t.co/z3bHVdJVPr,2017-09-02,76
TEXAS: We are with you today we are with you tomorrow and we will be with you EVERY SINGLE DAY AFTER to restore recover and REBUILD! https://t.co/p1Fh8jmmFA,2017-09-02,76
Together we will prevail in the GREAT state of Texas. We love you!GOD BLESS TEXAS &amp; GOD BLESS THE USA???§???? https://t.co/1rzmEenQIb,2017-09-03,76
RT @ColumbiaBugle: @realDonaldTrump Love our @FLOTUS! https://t.co/6LT9mLAJ86,2017-09-03,76
RT @ColumbiaBugle: @realDonaldTrump @FLOTUS President Trump greeting families affected by Hurricane Harvey. #TexasStrong https://t.co/5Ga3dƒ??,2017-09-03,76
RT @Team_Trump45: @realDonaldTrump  https://t.co/o1x6X2qQdM,2017-09-03,76
The Manufacturing Index rose to 59% the highest level since early 2011 - and we can do much better!,2017-09-03,76
Just got back to the White House from the Great States of Texas and Louisiana where things are going well. Such cooperation &amp; coordination!,2017-09-03,76
Remember Sunday is National Prayer Day (by Presidential Proclamation)!,2017-09-03,76
So much SPIRIT in LA! Thank you to all of our HEREOS who saved many lives. An honor to spend time w/ @NationalGuard #LEOs &amp; the #CajunNavy! https://t.co/7PEtSL6RKF,2017-09-03,76
North Korea has conducted a major Nuclear Test. Their words and actions continue to be very hostile and dangerous to the United States.....,2017-09-03,76
..North Korea is a rogue nation which has become a great threat and embarrassment to China which is trying to help but with little success.,2017-09-03,76
South Korea is finding as I have told them that their talk of appeasement with North Korea will not work they only understand one thing!,2017-09-03,76
I will be meeting General Kelly General Mattis and other military leaders at the White House to discuss North Korea. Thank you.,2017-09-03,76
The United States is considering in addition to other options stopping all trade with any country doing business with North Korea.,2017-09-03,76
We are building our future with American hands American labor American iron aluminum and steel. Happy #LaborDay! https://t.co/lyvtNfQ5IO,2017-09-04,76
Big week coming up!,2017-09-05,77
Congress get ready to do your job - DACA!,2017-09-05,77
RT @DanScavino: 'Trump as Commander in Chief Making the Hard Decisions' by LTG (Ret) Kellogg a highly decorated Vietnam War Vet: https://ƒ??,2017-09-05,77
I am allowing Japan &amp; South Korea to buy a substantially increased amount of highly sophisticated military equipment from the United States.,2017-09-05,77
RT @The_Trump_Train: @realDonaldTrump Make no mistake we are going to put the interest of AMERICAN CITIZENS FIRST! The forgotten men &amp; wƒ??,2017-09-05,77
I look forward to working w/ D's + R's in Congress to address immigration reform in a way that puts hardworking citizens of our country 1st.,2017-09-05,77
Congress now has 6 months to legalize DACA (something the Obama Administration was unable to do). If they can't I will revisit this issue!,2017-09-06,77
Will be going to North Dakota today to discuss tax reform and tax cuts. We are the highest taxed nation in the world - that will change.,2017-09-06,77
Watching Hurricane closely. My team which has done and is doing such a good job in Texas is already in Florida. No rest for the weary!,2017-09-06,77
Hurricane looks like largest ever recorded in the Atlantic!,2017-09-06,77
RT @VP: .@POTUS is committed to the health &amp; well-being of the US people &amp; we are confident Dr. Jerome Adams will succeed as our new surgeoƒ??,2017-09-06,77
'President Donald J. Trump Approves Emergency Declarations'ƒ?_‹?èhttps://t.co/xSHSyNkvuPƒ?_‹?èhttps://t.co/UbBSFOhMM7ƒ?_‹?èhttps://t.co/xWOfp9Z9iR https://t.co/qoJOM54Gy8,2017-09-06,77
Just spoke w/ Governors Rick Scott of Florida Kenneth Mapp of the U.S. Virgin Islands &amp; Ricardo Rossell?? of Puerto Rico. WE ARE W/ YOU ALL! https://t.co/k92cslgKFa,2017-09-06,77
Wonderful to be in North Dakota with the incredible hardworking men &amp; women @ the Andeavor Refinery. Full remarks: ???ùhttps://t.co/uxBpyeERUm https://t.co/fV9R9gJxDS,2017-09-06,77
Thank you for joining me in Mandan ND Gov. @DougBurgum Lt. Gov. @BrentSanfordND @SenJohnHoeven @RepKevinCramer &amp; @SenatorHeitkamp. https://t.co/8nIvtHvpu6,2017-09-07,77
If we want to renew our PROSPERITY restore OPPORTUNITY &amp; re-establish our economic DOMINANCE then we need tax reform that is pro-growth.. https://t.co/9NzLg2Qzpo,2017-09-07,77
We want our companies to hire &amp; grow in AMERICA to raise wages for AMERICAN workers &amp; to help rebuild our AMERICAN cities &amp; towns! #USA???§???? https://t.co/sglubjcbW4,2017-09-07,77
Hurricane Irma is raging but we have great teams of talented and brave people already in place and ready to help. Be careful be safe! #FEMA,2017-09-07,77
Thank you our great honor! https://t.co/StrciEwuWs,2017-09-07,77
RT @GOP: .@POTUS: I want to work with Congress Republicans and Democrats on a plan that is pro-growth pro-jobs pro-worker and pro-Amerƒ??,2017-09-07,77
RT @WhiteHouse: The current tax code is a burden on American taxpayers and harmful to American job-creators. Learn more: https://t.co/w5eMlƒ??,2017-09-07,77
RT @GOP: .@IvankaTrump: This administration is committed to keeping working families at the forefront of our agenda.https://t.co/rHqFqUJGWI,2017-09-07,77
For all of those (DACA) that are concerned about your status during the 6 month period you have nothing to worry about - No action!,2017-09-07,77
Welcome to the @WhiteHouse Amir Sabah al-Ahmed al-Jaber al-Sabah of Kuwait! Joint press conference coming up soon: https://t.co/8T4Nyzlp4Y https://t.co/lfRa4AATaM,2017-09-07,77
Together we will show the world that the forces of destruction and extremism are NO MATCH for the BLESSINGS of PROSPERITY and PEACE! https://t.co/aL6In83eWK,2017-09-07,77
During my trip to Saudi Arabia I spoke to the leaders of more than 50 Arab &amp; Muslim nations about the need to confront our shared enemies.. https://t.co/8oeAQfIeX8,2017-09-07,77
I encourage EVERYONE in the path of #HurricaneIrma to heed the advice and orders of local &amp; state officials! https://t.co/AQmawTpZs0,2017-09-08,78
We will confront ANY challenge no matter how strong the winds or high the water. Iƒ??m proud to stand with Presidents for #OneAmericaAppeal.,2017-09-08,78
Hurricane Irma is of epic proportion perhaps bigger than we have ever seen. Be safe and get out of its wayif possible. Federal G is ready!,2017-09-08,78
Our incredible U.S. Coast Guard saved more than 15000 lives last week with Harvey. Irma could be even tougher. We love our Coast Guard!,2017-09-08,78
Republicans sorry but I've been hearing about Repeal &amp; Replace for 7 years didn't happen! Even worse the Senate Filibuster Rule will....,2017-09-08,78
...never allow the Republicans to pass even great legislation. 8 Dems control - will rarely get 60 (vs. 51) votes. It is a Repub Death Wish!,2017-09-08,78
Republicans must start the Tax Reform/Tax Cut legislation ASAP. Don't wait until the end of September. Needed now more than ever. Hurry!,2017-09-08,78
A message to my fellow Americans???§????#IrmaHurricane2017???ùhttps://t.co/jyg6AlyAAb???ùhttps://t.co/iPujtHzejr https://t.co/HCQ9kmKc4E,2017-09-08,78
Churches in Texas should be entitled to reimbursement from FEMA Relief Funds for helping victims of Hurricane Harvey (just like others).,2017-09-09,78
FLORIDA- Visit https://t.co/pdBaD9t8SK to find shelters road closures &amp; evacuation routes. Helpful Twitter list: https://t.co/BUMVlxGFe8 https://t.co/ncnuqCeB5K,2017-09-09,78
This is a storm of enormous destructive power and I ask everyone in the stormƒ??s path to heed ALL instructions from government officials. https://t.co/nJfM2Sdme1,2017-09-09,78
"Heed the advice of @FLGovScott!""If you're in an evacuation zone you need to get to a shelter...there's not many hours left."" Gov. Scott https://t.co/92W8ViNMUK",2017-09-10,78
The U.S. Coast Guard FEMA and all Federal and State brave people are ready. Here comes Irma. God bless everyone!,2017-09-10,78
RT @EricTrump: Please stay safe #Florida! You are in our thoughts and we are praying for you! ???§???????§???????§???? https://t.co/B3998hZyHI,2017-09-10,78
RT @Scavino45: Florida Governor Rick @FLGovScott. #HurricaineIrma https://t.co/ch3wx9HDMj,2017-09-10,78
RT @DonaldJTrumpJr: Great pic from a friend on @CBPflorida @CustomsBorder who have been helping with #harvey recovery and now with #irma. Tƒ??,2017-09-10,78
RT @seanhannity: @ericbolling To my dear friend please know we all love you will be here for you and your family.,2017-09-10,78
